2019-07-20 21:37:47,3,还行,11,火枪手吱吱,【6】封建时代的神话故事中，哪吒无疑是最具反叛精神的一位。他和托塔李靖之间统治—反抗的复杂关系，决绝的弑父倾向使其成为（君为臣纲，父为子纲的）体制外异端。从《青少年哪吒》到《少女哪吒》，每一次银幕形象的演变都不改反父君权的核心特质。国漫版大刀阔斧地改编了父子关系，大打骨肉相连温情牌，更符合大众审美期待。导演说改掉原著“割肉还父”是为了减少血腥成分，其实丧失了个人意志和东方伦理相悖的悲怆感。改编好坏，见仁见智，也许如今更需要的是一个被阉割的英雄。
2019-07-28 00:14:54,3,还行,16,超cute侠,不是说颠覆经典不好，只是原著里剔骨还父的决绝变成了父子乡亲大和解，嘴上说着我命由我不由天，实际上反骨已被磨平，这样的哪吒不再是那个对抗父权对抗体制的个体，成了被招安被主流的英雄投射，这种泯然众人的个性设计有些令人失望，而且略显粗俗的笑点有讨好大众之嫌，令影片的气质也不土不洋，三星还是给技术，配音也是糟糕。
2019-08-06 18:28:09,3,还行,11,氯化银溶解,【C】作为一部低幼向的动画，不要求台词多高深，只希望不要太烂俗，网络段子式的人物对话不可取。
2019-07-27 08:53:27,3,还行,5,Flipped244,制作还行。配乐优秀！！！但核心剧情总觉得像是“一拳打在棉花上”，逻辑禁不起细推，主旨和具体内容不贴，群像稍差，立意没有立起来，看完感觉有点莫名的不舒服ps我觉得大藕霸动态没有小藕霸亮眼pps殷十娘真好啊555亲情线太好哭了。ppps藕霸和敖丙的初遇蛮搞笑的。（不瞒你说，我们藕霸其实是这部影片的搞笑担当www
2019-07-28 22:51:11,3,还行,5,海绵体宝宝,言过其实
2019-07-27 16:52:52,3,还行,5,Patrick/小白,拍得gay里gay气的
2019-07-19 22:10:02,3,还行,18,Toulon,特效和画风都很好，但说实话有点不太感冒，为了做到偏低幼，剧情和人物的设置都太过于套路，笑点更是尴尬多过好笑，在观影的过程中很难对我有很好的引导，思维也频频出戏，哪吒也成了大圣，仿佛现在是个主角就一定要忍辱负重，大声喊着一句“我命由我不由天”。
2019-07-21 10:34:27,3,还行,19,贝塔先生,3D无必要，哪吒的桀骜不驯变成了非主流朋克，不咋喜欢人设。
2019-07-21 10:40:35,3,还行,21,韦婉,还行吧其实。求求您了。换个剧情行不。别再中国神话了。
2019-08-02 15:35:52,3,还行,4,桃子,结论是：还是喜欢“上美”版。这版，意识形态，确实是新的（表面上）。但美学体系的确差太多。没办法，现在的制作人员找素材可能都是往西方找了……看看上美版，美术、音乐、姿态（舞蹈）都是亚洲语系的，整体呈现就很有艺术感。说回意识形态，表面上是打破成见的主题，其实充满了stereotype：喜剧担当的娘man、被嘲笑是猪的胖子、高富帅的龙子……抱歉说到阶级，但原本故事的设定真的不是这样一个艳俗和开心麻花式“热幽默”的场子啊……
2019-07-20 00:39:26,3,还行,17,ZX,若说大鱼海棠还能勉强作为国产动画外向型文化输出旗手的话，这部“暴走哪吒”就选择退回到乡间，回到本土市场最熟悉的语境，大胆结合无厘头风格，用最市井气的戏谑方式不断挑逗观众笑穴，川普、肥仔、结巴、娘炮……这些烂梗甚至比星爷如今的新片还要起效，但是否还会被无厘头感染那就因人而异了。无论喜剧这块是否接受，剧本的成功是一个共识，将传统神话改编的合理又聪明，保障了主剧情没给人明显恼人的观感，能安全看完都觉得是万幸wlichenjie
2019-07-27 16:30:01,3,还行,3,Whale,对国产不苛刻的话，354分是有的。技术国内团队真的很不错了，故事和结构依然是硬伤。哪吒感人的地方在于角色不再光正伟岸，而有着一定程度的真实，这一点能够值回票价。但是美术的西化欧化，并没有太多的惊喜，包括炒cp的概念，不吻合个人审美。国产加油。
2019-07-24 01:10:57,3,还行,9,小A萌,40年前的哪吒反抗父权反抗忠义礼孝的儒家思想，40年后的哪吒寻找自我认同，父母犹如当代外出打工的家长一般日常缺席，但关键时刻为了儿子可以付出一切。感人是感人，但没有前一种痛，那种痛是独独属于中国人的痛，让只有几岁的我也会哭到喘不过气。——是曾经的动画片太有深度，还是现在的我们太容易感动？
2019-07-21 23:18:46,3,还行,9,東榆,笑点我是get不到啦，想象力蛮丰富的。
2019-07-27 12:57:47,3,还行,7,阿稚,四年了还在原地踏步
2019-07-21 01:05:27,3,还行,15,半时花开,节奏不行，人设立不住。传统话本里最重要的正邪善恶没讨论成功，配角的点角色，比主角的面角色更好。哪吒从一开始的戾气，不关心他人生死，到最后突然醒悟为陈塘关百姓抵御冰山，刻画废笔太多，过于冗余。父慈子孝，朋友之义，家族重任，最喜欢龙鳞的造万龙甲的片段。
2019-07-19 22:09:54,3,还行,11,dot,还行吧。
2019-07-23 22:39:04,3,还行,9,四两白干,被提醒的彩蛋还是彩蛋嘛？为什么国漫一定要做喜剧？陈塘关的老百姓真得惨，被冰雹砸，被大雨淋，被天雷劈，最后还要被下跪，感觉是腿被吓软了。鼓励国漫我给个三星吧。
2019-07-30 18:29:37,3,还行,4,Yome,還是無法接受這種畫風搬上大銀幕
2019-07-27 14:17:41,3,还行,8,樱桃小包子,父爱如山母慈子孝的哪吒被亲情感化、没有了三头六臂没有了转世莲花。必须说动画部分完成度挺高的，情绪节奏也不错。当默片更好，幽默部分的台词都像包贝尔写的。但是我最不喜欢的地方在于他明明杀死了79版的哪吒，可台词情节还时不时往上凑，暗戳戳的奸尸。时代需要这样的哪吒，那就大路朝天各走半边不好吗？
2019-07-28 21:30:13,3,还行,3,一生懸命养乐多,这个故事，就别给哪吒了。为什么不能设计一个新的角色，非得借用哪吒的内核呢？分镜的确代表了国漫的最高水准，但是故事呢？好好推敲一个故事吧。
2019-07-28 22:48:38,3,还行,3,舒农,当然啦，你说这部动画片取材自《四旦双冰史·章子怡列传》也不是不可以。
2019-07-20 21:09:05,3,还行,4,大四喜,想知道哪吒三太子的两个哥哥去哪儿了。
2019-08-06 20:26:36,3,还行,5,山今乌冬,这戏我实在太不可以了。画画得再好，内涵还是有缺陷。老土的网络段子式幽默，对肥胖、口吃、娘娘腔的嘲笑，嘴上说追求自我内里却在寻求他人认同的价值观，想要表现得不羁但看上去更像是俄罗斯蹲的儿童哪吒……不可以！如果这都叫“国漫崛起”，我好奇是这个四个字比较廉价还是这四个字被滥用了。
2019-07-27 14:36:22,3,还行,4,露琪亚黑猫酱,与其说是传统神话故事改编不如说是根据现在年轻观众口味审美和观影习惯套了大IP的原创故事。动作流畅和视觉创意是最大优点。被结界禁锢的人群中的异类哪吒就像是被手套禁锢的Elsa。人物在行为模式上更偏西方，你可以任性作怪撒脾气，父母不是封建卫道士大义灭亲镇压你而是无私奉献拼命保你命。女性角色不再隐身而是搭上女权主义顺风车斩妖除怪。克服成见的秘诀是你把它当现代故事看就行。没有中国传统文化精髓也没办法，毕竟是商业作品。
2019-07-21 21:10:41,3,还行,5,朱熠,一部合格的动画片不就应该是这个样子的吗？
2019-07-17 13:54:22,3,还行,5,内有恶犬,国漫逐渐成熟且套路着，乐此不疲喊口号和诸多笑点依然接受无能。
2019-07-27 20:03:14,3,还行,3,tankry,这个真人秀时代的创作困境是，我们认为一个或一组好的人设就可以完成有内容的表意，于是贴合符号，高喊口号，辅以影像提供快感，最后用公式化的剧情串联，就足够赚取所有似是而非的共情。更糟糕的是我们明知会落入主题先行的陷阱，却仍不甘心停下迎合市场的快餐车，电影而言，还差得远呢。
2019-07-29 16:30:54,3,还行,3,星星︱落在你头上,3星少，4星嫌多。
2019-07-17 21:34:10,3,还行,30,天霸,有点低开高走啊，客观讲实在高攀不起《大圣》。薄弱的画质，恶心的配音，口型不同步，尴尬的台词；幸好剧情还可以，哪吒把大圣没帅够的战斗场面补足了。ps猪兄全场最佳
2019-07-27 14:26:05,3,还行,3,淹然,撤换掉79版的反父权主题，大概也有基于「合家欢」的定位考量。新版的勇于颠覆和它想要完成的新命题「抗击偏见与命运」，这些都令人惊喜。但最可惜的是，整个故事没有有效撑起对主题的阐述，说着「我命由我、不由天」的哪吒，最后还是活成了人们希望他成为的样子啊，这是最叫人哀伤的。这怎能不让人怀念那个剔骨还父的哪吒呢？
2019-07-31 22:25:48,3,还行,1,OCT IO≯,三星少四星多，能感觉到主创对片里每一个人物的热爱，一些细节和人物的推倒重塑都可圈可点，但最后还是稍稍差了那么一口气，和白蛇有一样的感觉，哪吒的脸怎么看怎么像《海底总动员》里看牙医那小女孩，小白背后金主光线实锤，年初刚接完追光女一，现在又被安排轧进这部，可怕……
2019-08-02 11:03:09,3,还行,4,Zero。,一代人写一代人，每一次的改编都带着时代特征，相较上世纪的《哪吒闹海》，这一代的《哪吒》体现了育儿问题、原生家庭、舆论成见、出身、朋友、证明自己的焦虑等等“时兴”问题，以及制作方或是为了市场做出的低俗笑料，这一代的哪吒比上个世纪的哪吒“憋屈”太多了。但是，嚷嚷着“放下成见”，片中反复出现娘娘腔、胖子并以此为笑点，嚷嚷着“你是我唯一的朋友”的两个人一个毫不犹豫地刺向对方，一个大骂“魔头”，嚷嚷着“我命由我不由天”的哪吒最后乖乖等待雷击，这部电影制作得很好，画面、配乐都跟上了，以至于这些口号喊出来的时候非常震撼，但冷静下来想想，好像也就是口号、宣传的噱头罢了，有些细节的处理还很讽刺。国产动漫的一个特点就是经不起看完电影后的冷静思考，电影通过技巧刺激到人的燃点，精准营销，然后呢？盛赞之下，尽是隐忧。
2019-07-24 23:48:22,3,还行,21,De Profundis,名过其实，更偏向爆米花片，并不算是成人向动画，深度不够，教育意义充足却也不足。人物刻画还有很大提升空间。另外，可以营造的低俗笑点真的不好笑
2019-07-22 09:31:08,3,还行,4,Mrs Dancy,35
2019-08-01 04:19:56,3,还行,3,年度故事,哪吒最多两星半勉强鼓励一下不能再多～很久没写影评是因为没啥有亮点的片子，决定说说哪吒也只是因为这片子太火……三星全给特效，全片闪电掉帧不能忍，扣半星。和特效打斗成鲜明对比的本片灾难般的文本、人设和价值观输出，这三个方面的硬伤根本不能成为国漫的标杆，顶多16年小门神的水平。
2019-08-06 23:45:06,3,还行,3,最后的山神,国产动画新标杆。剔骨还肉变成魔童救赎，时代在变。对于中国神话的展现没有超出预期，可能后续封神系列会有突破
2019-07-27 18:48:49,3,还行,1,Luke,优缺点非常明显的动画，故事讲得特别好，但动画水准依然一言难尽。
2019-07-19 22:02:47,3,还行,6,野餐,7010太商业
2019-08-03 22:06:23,3,还行,0,妙可中国,当然要比大圣好，不总穿插那些低级趣味的笑料就更好了。有意识去构造宇宙是值得鼓励的，动作戏的想象力也已具备了，但是个体反抗的命题最后消解在滥情的父子情里，还是太可惜了。
2019-07-30 14:36:07,3,还行,3,老羊,这剧本改的、改得、改地真是充满迎合少年的气息啊！当然，编剧不是为了鼓励什么，也不会是反抗旧的XX和黑暗什么的，因为还没吃那么饱！只有一个目的：为了少年们的支付宝、微信转账！让哪吒给你一个看片的理由吧，激情的你们啊！
2019-07-27 18:16:39,3,还行,4,余小岛,好看，但不喜欢。好看在于制作精良，细节到位，有老港片的味道。但还是不喜欢这个哪吒的改编。弑父的哪吒变成因为父爱找到自我，他最大的敌人竟然变成了世人的眼光？差了点意思。
2019-08-06 23:41:10,3,还行,4,浅酌低唱,制作感觉不错的啦，情节有硬伤—哪吒和敖丙打架之前，没有交流直接开打，看不出朋友之间的信任，再就是哪吒的话语和思路，有点讨好观众的嫌疑。整体看得还是比较开心的，拿娘娘腔来恶搞真的俗了
2019-07-30 16:04:34,3,还行,2,鸿_渐,煽情的都不怎么喜欢。家族下何来个人的命运。太乙真人好吃懒做但是大方面不走歪路，典型的老油条，申公豹出身是硬伤，不受领导待见，剑走偏锋，向体制挑战。
2019-07-27 00:44:32,3,还行,12,丛二,这是一个被规训化和庸俗化的哪吒，剔骨还父的哪吒是孝道中国的神话异类与奇峰，强改后的我命由我不由天是糟蹋。魔灵双生的对照更是刻意制造压力，只能说剧情圆得顺溜，一路强行燃起吧。段子太俗。画面造型几无新意，这点很失望。
2019-07-31 01:22:17,3,还行,3,PUMAN。,剧情太单薄了台词有点差很多人物表情细节处理不太舒服看得出戏没get到笑点老套无趣cv是新人吗感觉配音不太行但是分镜不错打斗戏行云流水特效观感还ok三星半吧有时间的话推荐去影院支持一下
2019-07-21 20:16:01,3,还行,3,王美娃,导演有想法，但是需要个好编剧，好多台词和梗太尴尬了。为了鼓励可以三星半。
2019-07-27 17:02:25,3,还行,4,盲市,爱不起来，开场太乙真人卖丑就把我恶心到。也不知道是卑微的创作者姿态还是根本无能，本该出彩的想象力是如此贫瘠单薄，情感层面也全被低幼尴尬的抖机灵扰乱，所谓全新解构也不见得有多么高明，充其量就一挠痒痒。一个创作者如果目标就是叫兽20，贵国还是不要喊什么国产新希望了吧。
2019-07-27 19:37:23,3,还行,6,七卉,来来来，我给你们想好封神宇宙电影世界第一阶段：《哪吒》、《姜子牙》、《哪吒2》、《杨戳》、《姬发》、《封神演义1：凤鸣岐山》第二阶段：《哪吒3》、《杨戳2》、《姬发2》、《雷震子》、《封神演义2：武王伐纣》第三阶段：《土行孙与邓蝉玉》、《姬发3：内乱》、《姜子牙2》、《雷震子2》、《黄天化大战魔家四将》、《姜子牙3》、《申公豹》、《封神演义3诛仙通天》第四阶段《雷震子3》、《杨戳3：梅山七怪》、《封神演义4：牧野之战》（最后哪吒牺牲：Iamnezha打响指啪）
2019-08-01 22:41:25,3,还行,0,不想做神仙鱼,看完电影出来，刷到大帅告别豆瓣的广播。
2019-07-28 13:53:15,3,还行,6,伊莉丝悄悄地,前半段被毫无笑点的笑料填充，后半段则被多变如同过山车飙速的人物内心活动塞满。观影全程我能感受到编剧在隔着屏幕大吼你们都给我笑你们都给我哭你们都给我感动最迷的是最后的村民下跪，我甚至要怀疑他们是不是斯德哥尔摩患者。当然，哪吒和李靖的人物塑造很不错，两个少年的颜值也撑起半边天，然而这部作品已经被捧得过分高了。真是对不住，这个自来水我实在当不了。
2019-07-30 12:54:59,3,还行,1,Oasis,充其量就是个本土化的超英片，就算没有大惊小怪的人物反应以及网综式的反差笑点，三星半在我看来已经是天花板了，草草了事的结尾证明不了扬善抑恶的合理性，做自己得看天分。
2019-08-02 16:25:42,3,还行,2,人来人往,前面拍的太戏谑了
2019-07-27 23:27:33,3,还行,8,弥赛亚代言人,大致观察了下，喊什么“国漫崛起”“五星吹爆”的，基本都是豆瓣标记一百多的萌新，所以如果你观影量过千，对这部就……还是降低期待吧。内容深度远不及《大护法》（甚至弱于《大鱼海棠》），不过技术层面完胜；相比起上一部被无原则吹的《大圣归来》，《哪吒》最大的好处就是哪吒这个人物实实在在立住了，主角的真实可信带来的是故事的逻辑自洽，于是剧情完成度也成了近年来的国漫最佳——当然还远远达不到皮克斯、吉卜力那份余韵悠长的境界，但进步确实肉眼可见就是了。为什么只有三星？一来我从不喜欢把国产片独立于整个世界电影体系外评价，二来就事论事，前半段硬膈肌观众的尬笑点真心太多了……
2019-08-02 16:20:58,3,还行,3,惑星タントラ,为了强行制造笑点搞的无关剧情不如拿来把人物塑造得丰满点。
2019-07-22 02:53:41,3,还行,7,IIV,打斗很精彩，赞一个。但是最后仇人强行卖腐变基友，对于这个结局挺失望的
2019-07-23 23:07:42,3,还行,3,Alexa,故事线流畅，剧本没有太大硬伤。大场景美术过关，给模仿《千里江山图》式的画卷世界好评。有些打斗场景露怯，混天绫做的有点呆；有些角色的比例实在太奇怪，比如哪吒他爸；有些道具设计得太土了，熬丙拿着两个超大棒棒糖太二了……
2019-07-28 13:02:36,3,还行,3,疯子♥妖小孽我真的对你绝望了▓,35星，故事情节太松散老套了，看完就忘的那种。动画效果倒是很棒。
2019-07-29 02:09:35,3,还行,3,SteadyTheBuffs,这哪是“爹爹，你的骨肉，还给你”的哪吒阿。。。
2019-08-05 17:05:39,3,还行,1,丹朱AI🌵,敖丙好美啊我懂了大家为什么萌藕饼CP了。不过，敖丙这样修长的身材，不是该用剑吗？两个大锤子是什么鬼……改编很温暖，但是我还是更喜欢那个割肉还母剔骨还父的哪吒。
2019-07-21 23:36:05,3,还行,5,null,考虑儿童片定位，三颗半到四星是没问题的，现在分数虚高，所以三颗星吧。最大的悖论是结局：全片都在说不要在意别人的看法，最终的happyending在于哪吒终于得到了世人的认可，全崩。但不细想就还好，特效出色，但无惊喜。httptcnAillz7Yd
2019-08-03 21:50:06,3,还行,1,盛世美岩,大失所望，大量质量低下的网络段子，太过尴尬了，哪吒这个角色的塑造更可以说是全面失败，不知魔在哪儿，不知要反抗什么，还完全没有性格转折，到这里我多少明白了些六老师反感《大话西游》的原因，如果真要讲这个故事，有何必借着哪吒的皮呢？《哪吒》是个机敏的后生，粗暴地借鉴了国漫前辈的经验，并用一种集大成的方式试图做的一步到位，可还是让我觉得太急了。不过，如果这就是国漫该有的命，那倒也无需我们那几声小小的不和谐的声音。
2019-07-27 20:28:03,3,还行,1,被我对象发现了,低幼向
2019-07-27 22:17:57,3,还行,3,心生,7分。
2019-07-19 21:46:04,3,还行,3,调反唱唱,吒儿辛苦了。
2019-07-27 23:21:15,3,还行,2,lavi,当年喜欢怼天怼地怼父母哪吒小英雄的小朋友如今自己为人父母和孩子无止境的斗智斗勇一边开始自我催眠再熊也是亲生的怎样都接受的价值观一边走上比自己爹妈更鸡血的道路本来嫌哪吒形象太丑不想看盛名之下还是去看了哪吒还是太丑了特效动作剧情改编节奏是认可的但看似反转的剧情实际内核很讽刺的是天地君亲师不能更正统迎合受众点计算的有点多包括不少熊大熊二风的笑点。。。。有一种打开淘宝全是自己想买的东西算法过量的感觉另外敖丙救杀李靖夫妇反转的莫名其妙倒霉孩子剧情安排都莫名其妙不过这年头片子能放出来已经不错了
2019-07-30 15:11:00,3,还行,5,哈呜,很不错了👍笑点泪点都有了，但泪点有些太多太急。另外总觉得这不是我记忆中的哪吒，没有了割肉还母削骨还父的悲怆。
2019-07-29 00:52:57,3,还行,2,思维的翅膀,1CG细节让人不忍直视，哪吒表情僵硬，整个画面毫无美感可言，配乐特别俗，作为一个看过玩具总动员4和千与千寻的人，动画形式体现了工业体系和电脑软件的差距。2太说教，什么东西都得靠台词往外说，做不到用视觉艺术语言去表达3各个环节不完美，不过导演抓住封神演义的精髓和改编得不错，我们的导演缺这种抓住名著精髓结合所处时代做表达的能力
2019-07-21 17:44:26,3,还行,2,白鹭青岩半,每个时代的意识形态叙述大概最先会从神话故事开始——那版经典哪吒的动人之处其实在于舍小家弃父母的大无畏的革命英雄主义叙述；现在似乎无法再这么讲述，但修饰成含着金钥匙出生的官二代、富二代联手对抗更高级的劫难并在师父帮助下顺利通关的故事就实在有点……看的时候其实想到了李天一……35吧
2019-08-06 10:37:51,3,还行,3,GA,强行少年热血还好有一套完整的世界观顶着
2019-07-21 17:18:36,3,还行,3,Mockingpig,有些笑点真的是奇奇怪怪的，画面是好看的，剧情还是硬伤，有些情节尬到嘴角僵住。谁再说国漫崛起谁就死。
2019-07-28 23:42:39,3,还行,1,某J。624,非常适合市场的一部讨巧之作，的确无论从故事还是整体效果都比大圣更扎实，却也丢掉了最纯粹的核心。最后哪吒的我命由我不由天，特别微妙。倒是敖丙塑造得更完整合理。PS：这其实是写给周星驰的告白信吧。
2019-08-02 20:02:25,3,还行,1,汶子,哪吒的造型不是很喜欢，丑，阴暗在个性的塑造上不够积极，不太合适儿童观影
2019-07-17 23:26:32,3,还行,10,张咏轩Wayne®,花哨的动作场面和流畅的线条构图已是品质保证，再加上不难理解的故事背景和熟悉的对白文字语境，共情感亲切度是国外动画无法比拟的，说说问题存在，影片在哪吒这个灵魂角色上做出了改编创新，首先两个截然不同的形（丑）象（酷）于一身，把亦正亦邪自由不羁，不被世人认可的痞子英雄形象，通过几个有趣的细节描绘的淋漓尽致，但这样的改编难免被诟病，看似创新又有熟悉的味道，“绝代双骄”式剧情，太注重正邪对立，又在其中注入友情链接，为了人物厚度和行为矛盾，可总归还在套路规则，喜剧思维也停留在过去，并且过于落后和低级，场面相比《风语咒》缩水不少，还总是老一派，空间和维度都被玩烂了，也看腻了，国漫虽然这几年进步飞速，但对于塑造故事与开辟疆土宇宙，还是懒惰和匮乏的，除了保守的IP改编外，期待国漫未来能拓宽更多的路
2019-07-23 19:25:53,3,还行,1,温海生,封神世界的开端，看来公司的野心不小，就故事成品来看，走了一段四平八稳商业路线。
2019-07-30 22:16:32,3,还行,1,奥特小曼,相对于《大圣归来》来讲是剪辑与动画画面上的胜利，但在剧作上是失败的，第一幕与第二幕设置的还蛮好，笑点和叙事都比较流畅，但高潮的第三幕简直是全面崩塌，高潮点完全不像《大圣归来》那样热血感人，应有的仪式感在大战几番转折中被消耗殆尽，而且结尾过于仓促，对于国产动画片来说也就是个及格水平，很失望，不懂好在哪里。
2019-07-28 23:34:40,3,还行,1,阿丽丝,颠覆设定没问题，商业元素也都OK，制作水准可以算优秀了，动作画面都literally很好看，最致命的是人物行为逻辑不成立，每一次行动的动机都异常弱，包括主题“打破偏见拒绝认命活出我精彩”全都是用对白说出来的，一句话说完开始行动，根本没有时间为人物来积累情绪，转变简直快如风，几乎每一个人物都会对别人的话立刻做出强烈的反应，简单说来就是没过脑，有一部分原因是原本应该用来塑造人物的时间被大量的动作戏和画面渲染挤压了，敖丙的人设逻辑相比哪吒更立得住一些，哪吒作为一个三岁儿童，除了容易被言语挑动之外，毫无天真少年气，颓的时候像个丧逼社畜，被激怒的时候像个无脑二愣子，靠卖腐是拉不回来的。我觉得国内不管动画还是其他电影，真的要能说自己诚心认真在做电影，先把基本功做做扎实吧，还没到拼技术的时候呢。
2019-07-20 01:27:29,3,还行,0,pipboy,点映3D
2019-07-28 16:10:18,3,还行,2,神秘金针菇,改编很成功，确实值得一看，奈何台词还是欠雕琢，直白得让人略微不适，部分笑点很棒，部分恶俗。
2019-07-27 13:53:27,3,还行,3,默娘,我是不是特别喜欢，人物塑造太脸谱了，还我愤怒的小孩来！
