2019-07-16 13:43:25,5,力荐,22625,⎝丁凯乐⎠,实名反对最赞说烂片的评论，这是人类无法逃脱的真香定律！看完觉得不值票钱可以来快乐星球砍我！
2019-07-18 21:38:41,4,推荐,19959,凹凸,邓超救不起这暑期档，哪吒可以。
2019-07-18 13:53:20,4,推荐,17224,凌睿,看到海报和预告片，人们第一反应就是：哪吒太丑了。觉得丑就对了，因为本片讲的就是打破偏见。正如很多人一看这是国漫，就不看了；或者去看了，看了觉得还不错也要自动先扣20分。电影之中，骂哪吒是政治正确，只要你说哪吒是妖怪，就会有人跟着说；电影之外，骂国产片、国漫也成了政治正确，只要你骂它，就会有人给你点赞。其实哪吒不是妖怪，他也想降妖除魔洗清骂名；国漫也不都是烂片，也有人想拍一部佳作证明自己。比如这部《哪吒》。山河社稷图一幕真是天马行空，震撼无比，将曾经只存在于想象中的物品具象化，也将中国神话的无穷想象力展现得淋漓尽致。那些耳熟能详的故事，不再只是故事，而是能看到，能听到，能享受一场视觉盛宴。今年有《哪吒》，明年有《姜子牙》，封神电影宇宙即将开启。是时候以电影的形式让中国文化走向世界了。
2019-07-13 17:17:05,5,力荐,14456,嘟嘟熊之父,卧槽居然看哭了，这才是货真价实的国漫新希望，终于不再是假大空的中国风堆砌，而开始借神话寓言塑造真正的“小人物”。背负原罪的出身，命中注定的死期，对存在的笃定和身份的动摇，竟指向《刺客聂隐娘》的内核：一个人，没有同类。完整的世界观构建，父子母子师徒兄弟友敌，每一段关系都处理的有血有肉全无敷衍。美术剪辑配乐动作设计，处处都是亮点，就连喜剧部分也绝非装疯卖傻而存在无数细节作为支撑。海边夕阳踢毽和社稷图虚幻仙境两部分堪称绝美段落，飞驰想象力和一流制作实力的结合，值得一刷再刷。严格说是四星电影，但愿意加满五星狂推鼓励！
2019-07-14 18:12:22,5,力荐,11636,天马星,年度最佳动画，不，年度最佳影片，剧作上的成熟应该让同档期的《狮子王》跪下来叫爸爸，起承转合水到渠成且饱含情感力量，这种成熟度不管是在动画这种形式里还是脱离动画都值得所有国产商业电影学习。整部影片看下来，在形式上非常现代化，包括笑点台词都贴近现代网络化的生活，是谓形散，但是影片把握住了哪吒这个神话人物的内在精神：我命由我不由天，并且自始至终都贯彻下去，是谓神不散，包括反派敖丙及申公豹都人物弧光饱满，在非我族类其心必异的人类世界里，《哪吒之魔童降世》是为所有异类书写的颂歌，这部片子就如同蔡依林在金曲奖上说的：献给那些曾经认为自己没有任何机会与选择的你，请你一定要记得选择你自己，支持你自己。
2019-07-13 23:20:07,4,推荐,8066,亵渎电影,技术上还是当下国产动画电影的水准，但在剧作的完成度上，却是第一次这么成熟，这么优秀！以前大圣大鱼或者白蛇这些剧本有先天缺陷的庸常之辈，都被称作是国产动画电影的良心之作，直到这部哪吒，才算是做到了剧本层面上的优秀，兼顾了喜剧元素和主题深度，还为之后的封神宇宙开了一个好头，大家以后可以忘掉大圣了。导演把哪吒的故事做了颠覆性的改编，逆天改命的主题在哪吒身上爆发了耀眼的人物弧光，最后哪吒直接对着电影院里的观众说，今天是我生日宴，你们谁都不准哭，这一刻的泪点实在是太可怕了。第一次给国产动画做自来水，在这个萧条的暑期档，这部肯定会是爆款。
2019-07-17 21:22:38,5,力荐,7955,谢谢你们的鱼,牛逼！牛逼！牛逼！4年前翻着白眼看完了《大圣归来》，4年后热泪盈眶地看完这部《哪吒之魔童降世》。没想到2019不仅仅是中国科幻大片元年，本片更是和《白蛇：缘起》一块儿创造了国产动漫作品前所未有的高潮。扎实的故事，生动的角色，饱满的情绪，炸裂的场面，这一切都构成了110分钟云霄飞车式的、畅快淋漓的观影体验，表面上是哪吒的传奇，骨子里面是《绝代双骄》《悟空传》，毁天灭地的逆天气势更是燃破天际，好一曲震撼人心的“冰与火之歌”！都给老子去看！
2019-07-13 20:52:13,5,力荐,7180,居无间,牛逼了！没想到国产动画能把故事内核写得这么成熟，吊打《大圣归来》。好几场戏被震撼到，必须五星鼓励了。将“水淹陈塘关”的故事元素打碎了重构，人设和剧情完全依照阴阳哲学来做。太极生两仪，混元珠分为魔丸（火）和灵珠（水）。太乙真人与申公豹，哪吒与敖丙，皆是一体双生。命运的偏离带来了秩序的倒错，于是，善与恶的边界变得越加复杂起来，耐人寻味。每个主要角色都带着宿命感，向死而生，阴阳相合打破命运。哪吒形象很颠覆，华语电影里也是难得一见，最重要的反叛精神立住了。导演想击打全龄观众，而那些嬉笑段落在关键时刻也催生出了悲情，让人泪目。高潮部分的场面戏够燃够磅礴，而且情绪饱满。以后再出国产动画，都将和它比较。
2019-07-14 21:19:36,5,力荐,5293,影志,“不成，功变成仁”、《神仙的自我修养》、“申公公”、内服外敷效果都一样的解药…前面快笑死；指点江山笔、英气的敖丙、猪鼻子倒带器…中间各种神来之笔；“人心的偏见是座大山，你是谁只有你自己才说了算”、父母面前的生离死别…结尾又被感动得一把老泪。老妈的性格更立体，老爸李靖对哪吒说你的真实身份其实是…时，生怕他说出个“蛋”，这是这部毫不正经却又硬气热血至死的片子能干出来的事。集丧逼和燃于一身，在哪吒面前，没人帅的起来！锁定今年最佳国产动画。
2019-07-19 11:38:43,4,推荐,4761,阿珂,这个夏天还有比“藕饼”cp更火的吗？
2019-07-19 11:37:10,5,力荐,4048,使君子,休说苍天不由人，我命由我不由天。新的故事，改编的很不错啊，就是有点短。友情提醒：观影记得带纸巾
2019-07-18 21:23:14,4,推荐,3067,徐若风,客观上的确是目前国产三维动画中的最佳。和年初的《白蛇》一道，富足想象力之下的经典魔改，在人物、情节和视听呈现上都冲着一股劲。不夸张地说，这部作品在今年全球范围动画中比，都可以排到最前列。但还是有些遗憾，双生的概念没有做得更加复杂深刻、部分低俗笑料虽有趣但跳线。可能是我期待太高了。
2019-07-18 22:55:23,4,推荐,1684,掉线🌈,【B】这才叫真正的国漫崛起！美术，制作，人物塑造，立意都比大圣归来更好。最重要的是你真的能感觉到创作者不故步自封的力求突破，也终于在国漫里看到了一直缺少的“想象力”存在（虽然只是在场景，物件设定上这些较为基础的部分，但未必不是个好的开始），缺点是整体风格略显杂糅，笑点像港式无厘头，战斗场面像日漫，有的地方又有仙侠和好莱坞动画的影子，但最后个效果居然不错，而且对于仍处于摸索阶段的国产动画来说这完全能理解。另外，一个动画片的父子情都比隔壁《银河补习班》更真实动人，邓超和俞白眉请出来挨打。
2019-07-14 20:33:33,5,力荐,1271,有心打扰,神话故事新编，以一种不令人悲伤的方式来讲述悲伤的哪吒童年。丰富多元充满想象力画面；包含幽默、热血、感人和人生观点的剧情；还有安排得当的叙事节奏，结尾处高潮更是一波接一波，让观众又是激动万分，又是感动落泪，实在令人佩服，这就是一部优秀的动画电影。
2019-07-19 11:23:34,5,力荐,1353,君子念,看完就想卧槽！！！太特么好看了！！！这是我观影史上第一次观众自发鼓掌！！！哪吒小爷太值得了！！！跟敖丙CP太好嗑了！！！等上映了我要二刷！！！大家不去电影院真的会后悔死！我错过了开场十分钟，肠子都悔青了！！！
2019-07-19 11:03:49,4,推荐,1134,二十二岛主,戏说不是胡说，改编不是乱编。把太乙真人设计成和肥猪作伴，哪吒和敖丙还能成为朋友，如果按照六老师的逻辑，这部电影的主创团队是要向本国人民谢罪的。但你不能否认它确实足够好看，而且并没有脱离《封神演义》中哪吒故事的框架，只是在几个重要的情节点上进行了富有现代意义和人情味的改编，很有创新颠覆精神。电影中几乎每一个角色都能够立得住，尤其是围绕哪吒的觉醒、亲情、友情都进行了合理且动人的铺垫，可以说这三条线每一条单独拎出来想做好都不容易，而做好了汇聚起来释放出的力量真的就是又感动又燃。本质还是想探讨人定胜天的问题，成佛成魔全在一念之间，最重要的还是做自己，这可比某些鸡汤说教的要容易接受的多。小包袱很多，但有的实在过于低俗，放屁梗熊gay梗那些让人看着实在不舒服，总体瑕不掩瑜，值得一个好成绩的鼓励。
2019-07-19 12:24:01,5,力荐,1083,阿德,暑期档到目前为止最好看的一部。真正打动我的不是哪吒的人设，而是找回了久违的看港片喜剧的快感！
2019-07-26 16:29:58,4,推荐,725,桃桃淘电影,7分，制作确实非常突出，尤其是夕阳下踢毽子和变身两场戏，印象深刻。这也说明，华语动画只要真是踏踏实实下来做苦功夫，还是能出佳作的。剧情相比老版做了很多革新，包括新增的父子情，这个见仁见智吧。主题则是神魔我做主，我命由我不由天的中二少年感，放到现在倒是挺燃的。哪吒变身之后也是大加分，跟敖丙的兄弟情也是相当新时代趣味了。希望每一部用心制作的华语动画，都能有好的成绩吧。不过，个人还是觉得大圣更好些，所以，刚刚还专门给大圣改了分，这样才公平些。都好都好，都加油，都加油
2019-07-28 22:05:56,4,推荐,919,明安,“所有龙把鳞片扣下来的时候，我真的感觉敖丙压力太大了。”“我们全村可就指望你一个人去考大学了啊，一定要上清华啊。”“就算把其他报清华的人都杀掉你也一定要考上啊！”
2019-07-13 17:30:17,4,推荐,911,法兰西胶片,85分。逆天之作，大家可以给《大圣归来》改分了。
2019-07-19 16:22:30,5,力荐,976,风林火山,这个分数偏低了。在《哪吒闹海》诞生40年后迎来的又一部哪吒作品，真香！
2019-07-19 21:40:56,4,推荐,596,哪吒男,谢谢把我拍的这么好！
2019-07-13 17:46:17,5,力荐,748,Cycble,1、人心中的成见是一座大山，但我命由我不由天，是魔是仙，我是谁只有我自己说了算。2、哪吒和熬丙的打斗，是魔丸和灵珠的左右互搏，更是善与恶的现身说法，人性本善本恶并不重要，重要的是你习得的教育是什么，你要成为什么样的人。3、“今天是我的生日宴，你们谁都不准哭。”哭成狗了好吗。4、东北天后夏岗丽本色出演的群演太好笑了，哈哈哈哈哈。5、和“是他是他就是他”的小哪吒完全是两个故事了，不是毁三观，而是打开了封神榜新世界的大门，改编的太好了，这个夏天，绝对要爆爆爆啊。6、想了好久这部电影的问题是什么，大概是改了哪咤自刎，割肉还母，削骨还父的悲剧内核。
2019-07-20 16:53:55,4,推荐,537,姨妈的鸭,一切都很好，但是哪吒，我想我看过更好的。
2019-07-14 17:10:56,4,推荐,515,孔鲤,点映看完了，不剧透地说，除了哪吒和他娘的人物关系外，这部电影把传统的哪吒故事里人物关系都改变了，哪吒和李靖、哪吒和太乙、哪吒和敖丙等等，因为有这些关系要重新做，所以这些人物的设定才和传统的不一样。整部电影本身严格按照商业片的形式，几个情感转折的节点都掐准了时间，不夸张地说，如果这个系列电影要做下去的话（还有之前的大圣、之后的姜子牙等），《大圣归来》和《魔童降世》在这个系列的地位相当于这个系列的《钢铁侠01》和《美国队长01》，但前提是一定要做下去。
2019-07-13 17:48:47,4,推荐,353,方枪枪,童年时期，最难忘的一个画面就是哪吒自刎！这么多年过去了，又看到了一个看起来丑爆丑爆的哪吒。故事在原作基础上做了颠覆性改编，面子上不必多说，里子中关于父爱的感动，自我认知的成长，世俗偏见的以及反叛意识，都值得称道。还有很多现代化元素的融合也别有趣味！自来水安利，去看就对了…
2019-07-26 16:13:23,4,推荐,227,frozenmoon,人不过就是半神半魔的造物，这故事按照这个路子衍生。整体非常工整，技术让人赞叹，自《大圣归来》到《哪吒》，这条从中国神话拿改素材的动画之路被证明是最经济实惠的。这里面其实有着另外可以深化的内容，就是几个角色的象征，哪吒像个为民请命的知识分子，但被庸众看作妖怪，他的叛逆不被理解和尊重，龙王是个归顺的反叛者，但被招安并不代表被信任，他的下场故事里讲得很清楚，而敖丙是甩脱出身帽子的唯一机会，而最终，这个年轻人和哪吒那个反叛者合二为一成为一个被大众颔首的理中客。这到底是成熟还是悲哀呢？只不过这个方向肯定不会被明确提点。想想有点悲哀，动画片的形式让这类作品成为了我们电影中最可能表达一些别样内容的容器，但也因为形式，那些表达最终被掩埋在搞笑和特效之中。
2019-07-23 16:39:17,4,推荐,200,木卫二,承认期待不高，看得有些意外。我不是哪吒迷，而更接近封神迷——实为情怀的那种玩意，所以看到片方想要铺封神宇宙，无论成败，总归是有人在做这么一步，并且，这一步，作为起点是恰如其分的。不存在“哪吒就应该是代表刻画什么精神”之类的说法，动画片也不是低幼倾向的文化产品。性格转变过快，密集迎合观众笑点之类的缺陷有不少，但来日可期，可以再打磨。
2019-07-14 17:33:52,5,力荐,382,深夜声咽,火然，意思是要火的样子。比大圣厉害多了。冰与火。不虐让再长大点再来虐吧，先美好童年先，从头笑到彩蛋，踢毽子感人。丑萌喜欢。坐等好影院屏幕二刷。3D记得带上眼镜儿火，火个小哪吒吧
2019-07-20 21:22:26,5,力荐,324,曼彻斯特的雪,比白蛇缘起更成熟，国漫又进步了！！！又燃又有内核，打戏，画面，人物表情，人物性格的塑造和心理建设，都堪称完美。“是魔是仙，我自己说了才算。”“我命由我不由天”“若命运不公，就和它斗到底”天生倔强，打破成见，这，就是哪吒！
2019-07-19 12:29:48,4,推荐,236,乌鸦火堂,这才是暑期电影应该有的样子，不闹海的哪吒，是文本与技术双成熟的华语动画。故事流畅、角色生动，虽然魔改，但整体路线还是以脍炙人口的大闹陈塘关故事为基础，且更符合当下文化价值。观感体验与大圣归来很像，笑料与热血并举。设定方面除了哪吒三件套外，山河社稷图、混元珠等设定都是源自封神的噱头，也有小云云、结界兄弟等可爱的原创角色。只可惜结尾大战意犹未尽，不算过瘾。至于画面嘛，制作水平早就不是华语动画的掣肘了，这部更是有着美观造型和时髦特效的视觉大餐
2019-07-18 21:56:37,4,推荐,196,寒枝雀静,C＋①相比被盛赞的剧本，反倒是视觉形象的建构比较出乎我意料：莲火毽子（鳞片）红莲的意象联结贯穿了全片，自细微琐屑至宏大奇观完成了完整回环而又颇具想象力的体系。②剧本其实有点过于依赖“孩童”人设，一方面助益了影片暗黑而又诙谐的混搭基调，另一方面也遮蔽了部分剧作上的仓促甚至让人物的成长显得不够充分（比如，“控制”的习得只是如此简单的事情吗？）。③导演对叙事时间的理解可能有些粗糙，连高潮戏一条线到一半时间停顿切到另一条线这样破坏节奏的小瑕疵都好几处。④至于大量不合时宜的笑料，让它们融入叙事的办法只有一个，就是添加让这些“异类”同样受到压抑的细节，而不是大大落落地丢包袱。
2019-07-13 19:12:00,5,力荐,266,刘小流,看到顶着黑眼圈、要吃人肉的哪吒出来，感觉就全对了。大家都知道颠覆好看，可多数颠覆改编问题在于，颠覆之后又要束手束脚，到最后干脆成了反颠覆。本片中成了魔童的哪吒，到最后同样没办法颠覆到底，但本片优秀在角色的转变遵循着最质朴的感情线——它是哪吒在人群中艰难的自我认知，也是哪吒父子的若即若离，它完全像极了多数父子关系模式中的对抗、理解与守护。让哪吒只是想不怂地活出个人样，便也不用到最后对人群不会消散的偏见选择性装瞎，更不用去印证百姓值得守护。这气质，真不多见。
2019-07-28 00:10:19,5,力荐,115,张小北,这是导演的动画长片处女作啊！
2019-07-19 21:30:13,4,推荐,163,欢乐分裂,35；较多低幼欢脱段子集合的表象并不能掩盖其悲剧的本质，越往后越动人，在改编原著的基础上，文本大刀阔斧地改变走向，奉献了一个在（国产）动画中难得一见具有邪气的魅力角色（取下乾坤圈，变身一刻堪称全片高光，碾压帅气敖丙）。善与恶，水与火，在充满偏见定论的二元世界，这两个承载了命运错弄的少年，最终以“我不信命”的信念发出天问，完满开启「封神」宇宙，十分期待了。申公豹和龙族的命运也非常具有意味深长的寓意，并为丰富主题的完成提供富含信息量的支线提供。
2019-07-27 00:28:14,4,推荐,138,LORENZO 洛伦佐,几个小缺点：娘炮那个梗用得有点太多了后面就烦了，结尾大战有些拖沓，段子堆得有些太密集了导致最后情绪有点破碎。其他都很好，比［大圣］好，可能是这几年最好的国产动画，李靖太可以了吧。
2019-07-19 21:14:42,5,力荐,279,吉尔伽美什,说烂片预订那大叔，动漫非得拍给小孩看？你不接受设定别代表大家，还有哪吒啥货色但绝不是你想的那种设定，好好多读书，再回去好好琢磨下封神。观后吹爆这片，今年最佳国漫。
2019-07-23 22:33:21,5,力荐,178,你大豪爷,哪吒就是那种看完了刷评论压根不会点开差评去读的片子，一定要看IMAX。
2019-07-28 01:13:54,4,推荐,113,danyboy,刨去了哪吒自杀还父的情节，就抽去了哪吒故事的灵魂。我只能说，这是另一个故事，我只能说这个新的关于青春期的故事讲的不错，舞美、画工、形象设计都好。但，这是一部拍给80后的电影，为人父母的80后很爱看吧；养过利维坦式宝宝的80后很爱看吧；熟悉周星驰式喜剧的80后很爱看吧；把自己代入到李靖夫妇而非哪吒和敖丙的80后们很爱看吧。你们一定很爱看，因为你们已经不再是曾经那个哪吒，而是守着工资的总兵咯。一言以蔽之，这不是哪吒的故事，但不妨碍是另一个讲的还算不错的故事。片尾曲的歌也不错。值得票价，就是我全程到目前都醉着。
2019-07-29 22:08:07,4,推荐,92,大島,一出生就有黑眼圈的孩子肯定不简单
2019-07-18 23:12:50,4,推荐,159,后自愈,中国动画缺的不是技术，是故事，和讲好故事的能力。在故事的完成度之余，还有一定的深度。最难能可贵的是，哪吒是个反传统的英雄，他天生反骨叛逆又肩负重任，他是不被认同的异类，在戏谑的打发愁苦之后，迎来最终的爆发，切切实实的感动。李靖也一直教育儿子哪吒，不要在意他人的眼光，要做自己想做的人，不要轻言放弃，包括在生日宴上对儿子说的一番话，一个不善言辞却一直包容理解儿子的父亲形象就油然而生了。要说教育和父子情，吊打隔壁《银河补习班》。
2019-07-17 22:02:07,4,推荐,117,西帕克,哪吒的削骨还父，削肉还母，被简化成父爱让他找到自我。原本故事中的反抗父权，也成了对抗世人的眼光。他的魔性可能像是科学怪人把小女孩扔入水中，只是因为对事物认知的体系不同。甚至屠龙的原罪也被略过，成了又一部“绝代双骄”。这样的叛逆更加通俗也更加安全，也是另一种时代精神吧。
2019-07-17 22:42:39,4,推荐,112,恶魔的步调,用周星驰的元素做中国式的幻想喜剧3DCG动画电影，这样的模板，确实是个可复刻的方向……
2019-07-13 15:15:45,4,推荐,136,谋杀游戏机,光线点映。冷不防看第一支预告确实有点挑战审美，不过看完就会完全爱上这个古灵精怪的混世小魔王，是当下流行的丧燃款。外表邪魅狂狷烟熏妆，内心是个单纯善良的小孩，好面子装酷很可爱。饺子是学医的，一点点自学成动画导演，了不起。制片人说这片并没有花很多钱，请不起一流特效公司，就找了一堆二流三流小公司磕了好几年。画面比大圣精细，前半段笑点密集，哪吒无敌破坏王状态、四个人追逐打斗长镜头很精彩，密码指纹解锁、坐骑放映机猪、山河社稷图、指点江山笔、三维弹球有很想象力。父爱、母爱、师恩、和基友敖丙亦敌亦友等人物关系也都刻画得比较充分。哪吒要拍成三部曲，明年还有姜子牙，非常期待上古版复联了！
2019-07-17 21:56:21,5,力荐,152,蒜 | BOY A✎,这个夏天一定会爆！以大家对大圣大鱼和白蛇的热情，这部国漫在完成度上圆满完成期待。第一次有了看好莱坞动画的流畅感和毫无尿点以及满满泪点，实在太不容易了。这次的剧本创作、节奏把握、主题升华、人物设定、视觉特效、巧妙笑点，皆弥补之前的种种短板，毫不夸张的说是一部集大成之作。期待暑期档刷爆豆瓣和朋友圈
2019-07-18 21:55:03,4,推荐,59,陆支羽,剧作上的确比《大圣归来》更成熟，但似乎还是少了点真正让人惊艳的时刻，尽管气势上没有输。
2019-07-26 21:17:45,4,推荐,53,把噗,徐克周星驰，精准复刻。
2019-07-19 22:39:30,4,推荐,65,Spiegel,印象中哪吒作为被压抑的个体的神话叙事，在这里被改编成为更具当代感觉结构的成长叙事，替创作者言说着“拒绝被定义”的主张。魔丸转世的哪吒被限制在儿童的身体里时，只是爱捣蛋的小孩，长大后才有摧毁世界的力量（但最终被引导），这种设定体现着人们对于“恶”的认知（凭借教养可以纠正）及其转变——善与或恶在这里不再是“摹仿”（mimesis），哪吒不再是受到摹仿欲望驱动且将通过献祭仪式替代暴力的受害者（victimhood）。他不由谁来定义，某种程度上已经成为了欲望机器。结尾一幕，他向观众投来凝视，非常自信。
2019-07-19 13:54:46,5,力荐,141,纳兰风澈,很像1970年之后的中国威胁论（魔童）、89年联合国制裁（关到死）、2001入世腾飞（当妖怪给他们瞧瞧）和2018年的中美贸易摩擦、华为事件（若命运不公斗到底）！2019最强国漫没有之一！！！
2019-07-30 18:30:54,4,推荐,28,大奇特(Grinch),哪吒和敖丙，其实就是小鱼儿与花无缺。魔丸和灵珠算一体两面的双胞胎，不同成长环境造就了不同的性格，一个是恶人谷魔星，一个是移花宫传人。小鱼儿不恶，花无缺却被恶人迷了心智，最后被设计打个你死我活。
2019-07-28 19:53:40,4,推荐,41,camus,中国的商业动画片已经甩开商业电影几百条街
2019-07-20 20:27:36,4,推荐,67,文刀大土申,二刷完毕，确定是我本月甚至今年的惊喜之作。妇孺皆知的“哪吒”神话传说在这里被重新解构，整体的故事完成度很高，这很难能可贵，辅以更具观赏性的喜剧元素，让整部片子的娱乐观赏性提升不少。
2019-07-28 20:41:10,5,力荐,38,大聪看电影,无疑，这是今年暑期唯一的爆款黑马。哪吒和敖丙的友谊，努力过，彼此成就过，此情有憾，然无对错，往后各生欢喜。哪吒和父母之间，同行半路，一别两宽，余生漫漫，依然亲情守候。
2019-07-14 17:36:55,5,力荐,119,zhang 2nd,做预告片的人可以开除了。以前看电影的时候，很激动，眼里含泪打转。这一次，我靠，眼泪流到脖子那儿了，没赶上截住。不过这片也有几段很差的，瑕不掩瑜
2019-07-27 11:41:12,4,推荐,64,万里独行甄志丙,有些人一谈中国电影就扯立意扯逻辑，谈漫威的时候标准就降到爆米花电影。
