2019-07-29 11:34:02,2,较差,4,斯托科夫,只说两点。1编剧把幼稚笑话和大众化划等号的思维急需改善。2看似积极的意识形态下掩盖着极大的逻辑漏洞。本意说出身决定不了人，但是一个哪吒，一个敖丙，天生神力；一个总兵子嗣，一个龙族后代，放到现在社会中怎么看都像是王思聪之流，因此他们有条件有能力选择自己的行为。反倒是百姓（比如我），若是能和哪吒大战三百回合倒也还显出些许主旨。可他们不但只有被动挨打的份，还被塑造得愚蠢无比，居心何在？
2019-07-21 13:14:42,1,很差,21,涅槃,三观不正，情节混乱，标新立异，细节粗糙
2019-08-02 16:24:13,2,较差,3,网友小张,啥啥做的都还行，但是剧作太烂了。你们没看过哪吒闹海也要看过少年英雄小哪吒吧？戏说不是胡说，改编不是乱编，李靖和哪吒谈什么父子情深呢？
2019-08-05 07:51:19,2,较差,1,海德,整部电影就是一种满拧。本该去反抗父权追逐自由的少年变成妈宝，严厉的父亲变成圣母。最厉害的是烩饼，从坏人变成好人再变坏人再变好。本片探讨的是无论是性本善还是性本恶，只要乖听父母师傅的话，即便你天生自带哥特骷髅妆，也都会有从良的机会。
2019-07-19 23:37:52,1,很差,10,Forever T-ara,烂剧
2019-08-02 08:25:00,2,较差,1,洗头油|盖盖儿,什么样的时代就有什么样的价值观，比如无底线的溺爱与迫害。好笑的是，看这场电影的时候旁边当我小孩儿大喊大叫说自己像不像哪吒？所以根本不苟同这是个正面输出……特效统筹我可以说很烂吗？烂眼儿。
2019-07-21 17:53:27,1,很差,10,御前带刀小狼狗,以前给大圣、白蛇这类电影高分，就好像给少儿组的金银牌一样现在国产动画电影成年了，毫无愧疚地给一星动画技术的成熟就像肉体的成年一样可惜脑子好像还没长好六学一下“改编不是乱编，戏说不是胡说”
2019-07-19 22:23:46,1,很差,5,芦田爱菜,不行，三星以下的评论都很中肯
2019-07-28 09:26:29,1,很差,7,愁容骑士,这么多人吹爆吹爆，我一脸问号。一点都不喜欢这一版哪咤，怀恋1979年那一版，凄美，刚烈，痛苦，但是畅快。19年这一版哪咤强行煽情加与父母和解，然后配音都很出戏尤其是哪咤的声音，浑身尴尬。当然，童年哪咤的形象真的是侮辱了我最喜欢的哪咤这个人物。微笑脸
2019-07-30 00:20:24,2,较差,2,sree,对白太粗俗了很多网络热词很尴尬
2019-07-27 18:38:05,2,较差,3,双立人厨房,李靖的儿子神仙钦定的灵珠转世，这也是天命，只不过这是好的命。一个宿命论背景下的故事，一个本就命运不凡的主角喊着命由己不由天，这很诡异，完全不能触动我。反而是几乎完全原创背景的龙族的故事，更值得展开。
2019-07-29 10:13:53,2,较差,3,懵懂,魔童降世，这哪里是什么魔童，两口鸡汤就给灌迷糊了，魔性哪儿去了？凭什么需要那些蝼蚁般的凡人去接受自己？这个电影里给我们的不是魔童降世的哪吒，而是一个弱鸡，不知道自己该怎样活着，没有主见，心理略微扭曲，长大之后也许抑郁也许变态，或者又抑郁又变态。父慈子孝，大家建设和谐社会吧。哪吒已死。
2019-07-27 13:48:10,2,较差,5,正在,不好意思，这片子是真垃圾。白蛇缘起都比它好
2019-08-03 14:16:08,2,较差,3,李的梯🌈,糟糕的台词，尴尬的笑点。也就画得好看点被吹上天了。另外，李靖的另外两个儿子去哪了？
2019-07-14 16:31:42,2,较差,6,水浅王八哥,两处逻辑bug但哪吒的改编仍让我无法接受
2019-07-24 20:03:00,1,很差,10,TERRYZY,嗯，下部应该拍杨戬和七仙女谈恋爱，花花公子杨戬偶遇七仙女之一并钟情之。玉帝不允，折磨之，后杨戬大喊我命由我不由你，虽死无憾，最终感动所有人，嗯国产佳作，剧情新奇，妙哉。
2019-08-03 20:02:45,2,较差,2,小二,随大流看的……智商感人……感觉当下的影视作品（包括观众的喜好）和好莱坞直接形成了平行宇宙……
2019-07-20 17:44:43,2,较差,3,浓情淡如你,我实在是很难理解那些说人物塑造饱满的观众考虑过踢个毽子就一起去死是什么奇葩逻辑吗？前半段低级网络笑料，后半段无比热血煽情，别再说国产良心动画了，就没人发现现在国产电影都是前面扯淡后面煽情吗。87分的院线动画片是个什么水平呢，是《驯龙高手》《疯狂原始人》《头脑特工队》《无敌破坏王》。恕我直言，哪吒两星不能再多
2019-07-23 23:03:47,2,较差,4,青鸟小姐不要飞,梗真的都太烂啦，光线要做封神宇宙却还没有处理好题材的现代翻译，故事都还在唱老调，不过工业的水平是到了。
2019-07-27 02:31:40,1,很差,2,DUNKEERKE,什么乱七八糟的当然也有人会说是创新，剧情还是人物设定？也许是打破了我们传统固定的剧情模式？反正看得我很尴尬人物之间的对话也是如此画质也没有什么突破和齐天大圣的画质差不多随后彩蛋的姜子牙难道要出一个宇宙系列？
2019-08-03 17:30:48,2,较差,1,末安弘明,这品味～实在是有点恶俗
2019-08-01 02:39:46,2,较差,2,strongman,哪吒长大以后，还跑英国弄了个乐队～
2019-07-20 19:18:25,2,较差,6,銃夢,原神话故事的内核更深刻吧。这个改变一塌糊涂，敖丙每每让我跳戏蛇精脸。哪吒少了原本削骨还父，削肉还母的决绝。配音也一言难尽。国产动画什么时候可以不一味追求特效画质，而是更注重核心的故事呢。
2019-07-24 22:41:39,1,很差,7,hiroshi,滚滚滚除了孙悟空就是哪吒就不能有点别的了？能不能有点其他的东西了有个屁的意思
2019-07-22 13:22:55,2,较差,13,大海绵,15。如果说他是一部优秀的商业动画电影我没有任何意见，但如果一定要扣上“国漫”崛起的帽子肯定是不认同的。从带有强烈皮克斯痕迹的哪吒童年建模形象到欧美剧作结构的文本内核，都如出一辙与大圣归来一个套路。于我个人而言，哪吒比大圣更吸引我的是他在对抗更高权利机构时家庭的羁绊与削肉还父还母时的决绝，而在影片里却替换成了庸俗至极的亲情和解，而代表更高权利机构的符号也被扭曲成了cp。至此，哪吒的“魂”已经消失不见了，更不用提那些依靠消费特殊人群堆砌出来的低俗笑料了。视效确实不错，但也只剩视效了。
2019-07-28 19:06:03,1,很差,7,冷空气和琉璃,我觉得很难看！！！在电影院坐了40min想溜了，感觉被朋友圈的口碑骗了啊，气。1一大堆过期的网络词汇，注定无法成为经典的2有人夸配音很棒，但我觉得怪违和的，尤其是哪吒声音、语速真的很不舒服，不大不小不男不女的3笑点很刻意…反正看了个开头就不行了orz
2019-08-06 00:20:58,2,较差,1,瓦达西瓦又又又桑只爱这巧克力,写了一堆，最后还是删了（怕收辱骂豆油，不过，估计还是要收的😂
2019-07-30 20:41:05,2,较差,3,小楼。,“一件明显糟糕的东西，其恶名不会维持太久，因为很快就会有人出来对其大加赞赏，人们会把它当作备受尊崇的东西，处处为之欢呼喝彩。”我觉得跟《大圣》相比也没啥质的进步，只是暴露的问题不同也更复杂了而已。
2019-07-29 23:49:54,1,很差,2,陈简,一边说要消灭成见，一边在笑娘娘腔，笑结巴，笑肥胖。一坨精致的屎。
2019-07-27 05:01:30,1,很差,11,蓝封语,尴尬，骑在经典上肆无忌惮的砸骨食髓。可以改编。可以原创。不可以消费我们的信任和童年。这片子垃圾到用着前人的电影，去圆自己的故事漏洞，让观众脑补剧情。网络小说一般的天才中二男主角。果然对你们口感。这个片子从密集的公众号推荐和豆瓣评分来看，营销很立体。豆瓣终于被流浪地球们攻克了。我再提个点，这电影上映2天12万人看过。呵呵，国产电影的人血馒头好吃吗？
2019-07-29 18:13:02,1,很差,0,〔已注销〕,期望越大，失望越大，一星给敖丙，笑点低俗，哪吒这个角色至少我没看出什么闪光灯，敖丙前脚救了陈塘关百姓和李靖夫妇，后面李靖就恩将仇报，而那些百姓也是见风使舵墙头草，全片各种插科打诨的无厘头，有些真的过了头，失望的电影，浪费票钱
2019-08-01 15:59:29,1,很差,2,Lily_Greenleaf,技术上的成功美学上的失败
2019-07-31 13:28:30,2,较差,2,诺米馒头,原来中国动画的新希望就是在美式动画的套路之下才能找到活路，原创这个词的分量太过沉重了，不如谄媚市场来一个名利双收轻松，文化侵蚀却不自知才是最可怕的，一两年后或许票房还能被大家乐道，但谁还会记得这个故事表达过什么？没有灵魂的躯壳充其量也就剩一乐呵，收好资本明年再来一波卖腐的文案，照样能赚得盆满钵满
2019-07-27 09:50:04,1,很差,2,莫失聪聪,第一：强行凑CP，卖腐，搞基！是不是一部优秀的动画片，不和这些联系到一起就没人看了？第二：终于明白章金莱说的改编不是乱编的意思了。
2019-07-30 15:47:29,2,较差,7,西奥多,哪吒给父母那一跪我真的觉得啥都没有了。一个激进的震撼的古典神话到了现代，内核竟然反而变得保守了。如果哪吒是团队自己创造出来的人物我会觉得这部影片还算及格。但哪吒是一个中国神话中少有的彻底的决绝的反抗父权的人物啊，怎么到了比任何时候都需要他这样的故事的时代，这个故事反而变成了一个父慈子孝，一个反抗虚无缥缈的“命运”的所谓“我命由我不由天”的成功鸡汤学呢？我也知道不是每一个人都那么苦大仇深，也不是每一个人进影院都想进行什么深刻的思考。但，古典神话的现代改编，实在是需要谨慎去做的一个事情，我们需要更多地去思考，当代社会究竟需要一个怎样的神话。原本可以选择另一条路另一种故事叙事逻辑的哪吒，却选择了最容易被大众接受的、最传统的、最娱乐的一种，这种收编是对现代社会荒谬性的最佳注脚。非常失望。
2019-07-23 21:48:16,2,较差,5,皮皮西,“国漫崛起”这个概念怕是要炒馊了，抱着很大的期待去看这个片子，真心失望。屎尿屁的段子为了搞笑而搞笑，纯当网络大电影看了。哪吒的精神意义表达太肤浅，乌合之众的表达都太浅层了，低幼向。
2019-08-02 20:34:19,2,较差,1,Luminiscencia,技术方面，也许是受限于经费等原因，有很多粗糙和僵硬的部分。不同段落之间，质量还参差不齐。敖丙的龙锤、哪吒的六臂，应该成为华彩篇章的，结果全都经不起细看。人物均符号化，口头上充满了对社会评价或偏见体系的反抗，但所有人物孜孜以求的依旧是社会认同。无论本性善恶与否，最终你都会被所在的社群和环境驯化，成为他们想要你承担的角色。
2019-08-04 19:42:29,1,很差,0,咆哮李,如坐针毡低俗幼稚。而且三观很恶心，申公豹成为了唯一一个脑子正常的人。百姓容易被煽动
2019-08-04 23:56:04,2,较差,0,美卡 mecca,804保利唐镇杜比全景声Polymax
2019-08-06 23:21:28,2,较差,2,LittleStrong,无聊剧情乱七八糟动作设计乱七八糟可劲吹呗屎吃多了给个鸡蛋炒饭也能当满汉全席了
2019-07-27 22:59:04,2,较差,1,大冢绯沙子,很不满意，给每个角色强行加上行为动机，过于牵强，故事不及格，辛苦分加一星。
2019-07-30 02:32:40,2,较差,4,穿包,故事相当没劲……
2019-07-27 17:37:05,2,较差,8,Agon,电影告诉我们，你不能对哪吒有成见，但可以嘲笑胖子、贬低结巴、歧视不man的男人哟，国漫之光呀👏
2019-08-06 08:43:43,1,很差,2,帅-よう すい,五星太多了，给个一星，给泼泼冷水。原谅我，看不出哪很好看，很多明显的笑点让人尬，情节现代化气息浓厚，故事讲的不好。龙族在这里面注定就是一个悲剧。
2019-08-05 17:41:25,2,较差,2,二货姐姐并不二,"为什么刷屏我不理解除去故事改成这般强行和谐以外，满篇放屁，混蛋，老娘的台词，还有一口京片子的哪吒真的符合人设么。还有那个女声的壮汉，我后面的女孩子问她妈这是男的还是女的🧐最让我迷惑的一点是：哪吒去太乙真人正面裤裆掏东西，真的不是猥亵儿童吗？我为什么担心会有人效仿幸亏我没花钱，否则，我又想抽自己了。"
2019-07-31 21:51:50,1,很差,0,王往,中国绝大多数动画导演的通病就是弄一些极为尴尬的身体伤害为笑料，关键是一点都不笑啊，一流的技术配上下流的剧本，毫无电影语言，毫无逻辑，硬着头皮硬撑的情节，垃圾的没办法再垃圾，一分全都给背后辛苦的电脑工作人员，这群人为一个智障服务，真是辛苦他们了，这片除了电脑技术还有一些打斗，从电影语言的角度来评价，真的是一无是处！明明是一坨屎！还有人觉得香，行，你们自己吃吧，拜拜！！
2019-08-01 22:48:22,1,很差,3,crusader,粗俗过了。
2019-07-26 14:02:11,1,很差,6,电影的戏与诗,好评都是睁着眼睛说瞎话。导演是一点审美都没有。低级俗烂的造型配音台词情节，中二少年审美的大杂烩。中国动画往这个方向发展，就是把孩子都往坑里带。
2019-07-19 21:46:46,2,较差,1,(●⊙(工)⊙●),对不起这么多网络段子我有点吃不下…………………………这种父慈子孝的场景也真的是让人意想不到…………………………国产动画缺的从来不是技术啊，什么时候能静下心来做故事，什么时候才有资格说国漫崛起呀。
2019-07-28 18:39:59,2,较差,3,Sherlock,任何一个稍微对语言有点敏感度的人，都会感觉耳朵受到了侵犯。北京这帮闭门造车的动画工作者这么用四川话，就跟美国人觉得全世界应该讲英语一样——你瞧你一口外国话多滑稽。乱七八糟的不仅是语言。以及，中国人依旧没有幽默感，对喜剧的理解极其肤浅，里面的逗哏都是剥削性的，自作聪明罢了。
2019-07-21 12:18:32,1,很差,4,喵呜~未清明,宣传烦
2019-07-21 21:14:14,2,较差,5,腿麻了,不要再辣菜大圣归来了，大家都剧情都单薄，人设单薄，谁瞧不起谁啊。起码大圣归来不玩屎尿屁和过期网络梗，起码大圣归来的确在试图解构孙悟空和唐僧的关系。这部呢？全篇下来就为了说其实最大的反派是元始天尊，魔丸怎么了？哪吒一点都不坏啊，他只不过是受了偏见所以叛逆啊，元始天尊吃饱了撑的至于就要大动干戈的非要搞死他吗？吹成这个样子，最后就是个网文梗大集合。连经典语录都要抄人家仙四云天河的。还真是国漫之光啊。ps想跟那个说骂国漫就是政治正确的人说一句，看看你的点赞数就应该知道，骂国漫不是政治正确，吹国漫才是。这片子放迪士尼出品，估计上6分都危险吧？
2019-07-30 22:44:04,1,很差,1,Necropolis,基情毁天灭地🤦♀️超讨厌哪吒这性格的恶心审美低劣节奏有问题段子低俗狂抖机灵
2019-07-29 20:22:42,2,较差,3,Bo Liu,故事挺有娱乐性的，不过都9012了一个娘的胡子壮汉、一个口吃的人有什么好笑的啊？这些梗不仅老得像化石了，又带有歧视意味。一边在这讲人被社会妖魔化一边又去笑和自己不一样的人，别把祖国花朵教得像你一样虚伪并且错乱了8。
2019-07-29 00:01:13,1,很差,1,粉红噪声台,一点都笑不出来只想猛翻白眼，生硬的角色转变让我感情上0代入感，我第一次觉得我和我的友邻离得那么远惹
2019-07-28 09:14:41,2,较差,1,浪客剑心拔刀斋,还行。
2019-07-26 21:32:58,2,较差,4,Pinko,豆瓣现在的评分都是沦陷了么？全片充满刻意庸俗粗糙的笑点。满满商业片的算计，利用观众的情怀宣传煽动。嫁接了西方的个人主义观念，却剥去了弑父的核心。人物性格发展突兀单一。全场好像只有我一个人不适，难道中国成年观众的笑点依然停留在肛门期？
2019-08-04 09:25:40,2,较差,0,小猪和大兔牙,这个片子是最近网络传国产动漫的巅峰之作，处于好奇，昨天下午和爱人去观影了。然而，故事情节不但改得面目全非，而且还加入很多庸俗的网络词和低俗的笑话。整篇核心内容就是：哪吒想打破人们对他的偏见，父母和师父也共同努力将他打造成别人期待的模样。最后一句：“我命由我不由天”与哪吒对抗天劫闭目等待命运安排很矛盾，反而是龙王之子在跟命运对抗。相对于《大鱼海棠》和《大圣归来》无论从故事情节还是绘画以及配音，要差很多。还是喜欢记忆中的那个哪吒，豆瓣评分只能给2星了。加油吧！
2019-07-27 18:31:05,1,很差,2,吴隐之,三俗如我，也受不了人物之恶俗，台词之低俗，色彩之艳俗。更不理解何谓评论里的“国漫崛起”，不论是外在形象、用语，还是故事线，都全然不是“国风”，全盘拿来主义大杂烩。
2019-08-04 09:19:42,1,很差,2,Vaisúre,我都好奇赞哪吒的与喷战狼的是不是一帮人？旧瓶装新酒？买情怀加抄袭？功夫熊猫是借鉴中国元素，古城荆棘王是对睡美人的又一次解读，哪吒呢，整个一个换名火影，换名就是抄袭，而且抄的剧情都讲不好也是服了，加上一如网游cg的质感，我只能说国电真的还要走很远，另外路别走偏了，剧情才是灵魂，看看爱死机，去学学？
2019-07-27 01:57:33,1,很差,4,Robb•Stark,哪吒的故事本是一个畅快狠决的浪漫式悲剧，浪漫狠决在于挑战霸权和父权，割肉还母剔骨还父，死后金身被李靖砸损，提枪二话不说就是追杀李靖，悲剧在于后被燃灯道人压在宝塔下焚烧，无奈之下与李靖和解强行父慈子孝，重塑莲身后封神南门、号三太子，硬是抹杀了他一身豪纵傲骨。我本想在大荧幕再次一睹这个传奇故事，不料看了个大型穿越同人剧。本想说至少画面制作水准有了十足的进步，但是想想当年上海美术制片厂制作的《哪吒闹海》，约莫进步的只有科技罢了。所以这个抛弃人物精神内涵，生硬笑料堆砌的故事，力压《大圣归来》？“国漫之光”？得了吧！😄撑死是《鬼吹灯》之后的《盗墓笔记》，唯一拉热度的就是CP卖腐了。可以当作搞笑同人剧来看，但他不是哪吒，他不是《封神演义》和《三角源流搜神大全》里的哪吒。
2019-08-01 07:27:39,1,很差,5,卡！！,什么玩意
2019-07-20 21:22:45,2,较差,7,萤九,俗套没创意，说教生硬很尴尬。
2019-08-02 17:40:28,1,很差,2,阳曲仙人,火影的结构幼稚模仿周星驰的形设笑料莫名其妙的桥段奇怪的细节价值观唉，可能是我有问题。
2019-08-03 19:51:18,2,较差,3,刺猬等待灭绝,我超勇，不喜欢。还是拿娘娘腔和胖子做笑料，很低俗。并没有感受到哪吒所说的“我命由我不由天”。两星给场景，做的很棒
2019-07-18 09:37:05,2,较差,0,英俊的兔酱🍖,79完爆19
2019-08-03 02:05:46,2,较差,3,房彤,支持国漫一星熬丙一星剧情内核主题什么鬼？完全无逻辑过誉了
2019-07-21 22:33:07,2,较差,7,leola,太二真太二，过度了低俗zz笑料，搞得剧情情绪不连贯。哪吒恶童形象扁平化，恶童铺垫超长令我产生了生理不适，后期无法正常观看。看完电影感觉被编剧耍了。但是画面真的很赞赞赞赞美制作公司。但由于画面的精美度与剧情丰满度不成正比，令人更加气愤跟惋惜。看完出电影院骂人了。
2019-07-29 18:06:43,1,很差,2,Kowloon Tong,不好意思食用不进退场了
2019-07-29 23:29:51,1,很差,2,请我吃Mango,好一个扫黑除恶！分镜太差！山河社稷图也没玩起来！还有糟糕的台词！
2019-07-29 09:22:32,2,较差,6,萧南生,国人的审美一直很魔幻，每天大烧烤小啤酒，假名牌高仿烂大街，走哪哪扔垃圾，一年读不上一本书，抖音快手小火山刷不停，约炮小软件24小时滴滴滴，P图P到亲妈都认不出来。但看了一部电影之后立马大变性，在朋友圈大肆喧呼赤子之心、人生哲学，各种热血沸腾、泪流满面。对一部电影的评价坚持三点式：泪点，笑点，燃点。你和他分辩两句，他反问你：知道什么叫情怀么？对不起，我不知道！
2019-07-21 21:44:14,2,较差,7,Miss one,"可能是抱着很高的期望，所以看完之后很是失望。我觉得特别受不了的是，一屋子成年人，因为“屎尿屁”，笑得那么大声。感觉整个电影里，没有一个人物是讨喜的。我都有点搞不明白，哪吒是不是这部剧里的反面人物。"
2019-07-28 09:21:22,2,较差,1,AI Samantha,有些梗，恕我直言，挺低俗的。
2019-08-04 09:36:17,1,很差,6,meow,剧情难看，方言难听，主角让人讨厌
2019-07-30 23:01:14,2,较差,2,森山大头,两个官二代，搞的全村人都生活在水生火热中，还在自我感动
2019-07-28 19:00:27,2,较差,3,ianw31,成年人真的喜欢这东西吗？没看出大圣后的进步，反而觉得大圣更好看。
2019-07-28 00:05:45,1,很差,1,五点共圆,奇观展现、低配超英，要不是搞笑段子太恶劣，我可能会以动画为评价给个两星的。
2019-08-05 23:37:28,2,较差,0,弄樱,对古典神话进行如此颠倒是非黑白的篡改竟然还能受到如此热捧，让人不寒而栗。天神龙族成了妖族，申公豹成了不帮纣王去帮龙王的豹子精，灵珠子竟然被用在了龙王太子身上，被哪吒抽龙筋扒龙皮的敖丙成了哪吒的好基友，殷氏被做成爱子狂魔强煽情，太乙真人被用来迎合恶俗审美……这不是后现代文化，是无知文化，更可怕的是在这种无知的基础上对”国漫崛起“这种新政治正确slogan的欢呼——对集体记忆的背叛就是对自己的亵渎。
2019-07-29 00:38:42,1,很差,3,Wyatt,看conductdisorderADHD患者发病是怎么看出爽感来的？为祸一方，作威作福的官二代即使让百姓怨声载道，作为地方大员的父亲依然能挟官威让全体百姓违心为其庆生。期间儿子再度发病，差些死于其手的地方大员故意暴露救命恩人身份。使得其恩人为灭口不得不活埋全城百姓。这时再让antisocial的官二代伺机出手，一举扭转其负面形象，让百姓感恩戴德，为其将来获取政治地位打下群众基础。就这么一个空洞黑暗令人不适的故事还要用喊口号式的对白强行升华，真是让人从头恶心到尾一秒都不浪费。有什么比电影更恶心的？大概就是写东西看钱不看良心的自媒体写的闭眼尬吹文。如果说要我推荐谁去看这部电影的话，如果我跟你没有仇的话，大概就是我觉得你的笑点真的比较低。反正我看人放屁，吐口水，吃鼻涕是笑不太出来。
2019-07-27 22:48:41,2,较差,0,Secret,ItshouldhavebeenagreatdomesticanimationFightingwiththedestinyisanuniquetitleHoweverforcommercialprofitthedirectorusetoomanyuselessspecialeffectsandpunchlineswhichdilutetheconnotationtomakeitbecomeaintermediatefilmWeshouldnotrecomposeourmythbarelywearesupposedtofindaCoreValueforChinesefilm
2019-07-31 19:03:52,2,较差,0,hikari,国漫之光，不配评价，下次再不换编剧我看要完
2019-07-30 17:16:08,1,很差,1,灰狼,除了抄来的火影忍者冰与火之歌其他都是老掉牙
2019-07-22 13:15:44,2,较差,4,白十九,CP粉请克制，别他妈在恋童的边缘打出溜滑，开童车真的挺恶心的
2019-07-20 18:09:27,2,较差,16,留声机与小提琴,明明就很土！！各种低俗无聊的梗加一些打了鸡血才能写出来的台词就为了讨好观众，等创作者不再做观众舔狗的时候再来和我说国漫最佳吧！某热评说内核指向《聂隐娘》是认真的吗？内核难道不是10年前的那些垃圾玄幻网文吗？不认命的内核真的土到家了。
2019-07-30 01:17:14,2,较差,4,Marine,同一个故事，远逊于79版。40年的时间只带来了美术上固化和故事内涵格调上的退步，实在是悲哀。
2019-08-01 09:49:36,2,较差,2,李太陽,剧情是cliche的用烂了的剧情，台词是快手抖音合集，把群众当傻子。不适合小孩也不适合成年人不要把不足怪罪到观影年龄和受众了。特效还可以但没必要为了国产而高潮
2019-07-21 01:19:25,1,很差,22,白,一星给一些角色形象设计，这不是哪吒
2019-07-23 21:53:27,2,较差,5,-,设计的笑点集齐了我最讨厌的元素——网络段子、方言梗、抖音套路、哭天喊地、撒泼打滚……土味溢出银幕。
2019-08-03 12:51:05,2,较差,2,还没熟的一果子,全程尴尬，人物没有灵魂，一会儿这样一会那样全是空壳。自以为拽的不行，全世界都要为他的命运买单，所有人物的存在都是道具，为了塑造创作者自恋的真命天子情节，拜托尊重一下观众。
