2019-07-16 21:52:16,5,力荐,22,陆冠均,实名吹爆《哪吒之魔童降世》！今年最好的国产动画电影已经诞生了！没有明显短板，亮点还特别突出，娱乐性和思想性都相当出色，期待正式公映后刷爆这个夏天！！！
2019-07-27 09:04:03,4,推荐,11,SebMia,看到《哪吒》将《银河补习班》挤下马我就放心了，祖国的花朵总算是得救了。同样是讲教育，哪吒只用心讲了一个道理：命运并非天注定，而是掌握在自己手里的。却比银河乱七八糟讲了一大堆要有用百倍。若不是为了迎合大众而刻意网络潮流化的台词和配音拖了后腿的话，就真的值8分以上了。7510，四星鼓励。
2019-07-28 19:56:57,4,推荐,10,冰淇林黛玉,好看，技术过关。但可以挖掘的深度没挖够，哪吒有点浅，同样要承受孤独与命运不公的敖丙也刻画得有点浅。而且太像是日本或者美国（更像美国）电影了，跟《功夫熊猫》或《花木兰》似的，中国元素只是点缀，而所有的国仇家恨悲剧宿命都化为了个人成长。个人成长没什么不好，只是看多了有点无聊。
2019-07-20 19:16:36,5,力荐,19,无人应答,怎么肥四！大概流了一盆眼泪。强大的动画表现力，富有想象的打斗设计，充满宿命论的辩证，既热血燃爆，又感人至深。期待封神榜宇宙。
2019-07-30 14:42:51,5,力荐,7,*ST斐济猫,最近唯一一个让人看到希望的东西，《大圣归来》之后很明显的进步。真正的中国的东西，是需要浪球还是这种，自己判断吧。
2019-07-21 19:56:40,5,力荐,14,小V,从头哭到尾，泪中带笑。看完回家需要再哭一小时才能平复心情。
2019-07-21 19:47:39,5,力荐,11,Brandon Stark,BGM让我想起权游片头，讲故事能力强，题材有点不对自己的胃口，四星好评，多一星给国漫，加油哦！
2019-08-06 14:27:30,5,力荐,13,Memorimorti,敖丙真的神似公子景。
2019-07-30 13:09:49,4,推荐,3,狄飞惊,红孩儿，孙悟空，猪八戒，花无缺……与之对应的致敬元素是以周星驰为代表的颠覆性和无厘头思维、以徐克为代表的后港片时代的技术理念、前网络时代的武侠烙印乃至一代人的迷影记忆拼贴，总体来看所有的料都是拿来主义，但做得相当丰富了。
2019-07-20 08:35:22,5,力荐,19,Johny,看了大半年的电影院放映前广告“我是小妖怪，逍遥又自在，杀人不眨眼……”终于看到片子了！看到吒儿变好，还真是别扭，他要是一直邪性那多可爱啊！！特喜欢殷夫人的配音，又贱又有母性，影片四星，脑残给五星！！
2019-07-17 21:47:25,5,力荐,34,小烨,可能预期太高，心理有落差，不过的确是近年来在国内院线看到的最好的国产动画。父子情让人落泪，社会主义兄弟情也很感人。“我命由我”主题非常好，然而，这个故事告诉我们，想要不认命跟天斗，即便有个能上天庭的好爹、有个能下深海的好基友、吸收了天地灵气强如哪吒，斗到最后也只能剩下一缕魂魄。
2019-08-06 15:54:46,5,力荐,17,瑞波恩,五星鼓励吧，不能说毫无遗憾，或什么国漫巅峰之作的大话，但论画风论诚意论剧情论立意与整体感觉，都是国漫近年来难得一见的精品。哪吒的人生本来就是不认命的人生，要与厄运对抗义无反顾。看得出饺子是有实力与想法的青年导演，不落俗套的大胆改编，天马行空的想象力殊为可贵，期待他未来的发展。
2019-07-17 23:24:04,4,推荐,18,注水龙,意外的好看。如此颠覆性的改编（魔改）消解了传统哪吒故事中的宿命色彩和弑父情怀，让哪吒喊出“我命由我不由天”便是最好的证明，也让这部动画更加适合全家观赏。导演也很好地平衡了喜剧和悲情的关系，最后煽情也是水到渠成，力抵千钧。节奏顺滑，人物个性鲜明，戏剧冲突精准有力，商业元素一应俱全（比如把传统的绝对反派敖丙改成了相生相伴的基友宿敌，满足广大cp粉），喜剧部分不尴尬，3D效果极为扎实，还出现了国产动画中极为少见的炫技式长镜头——我想问问各位，如今哪部国产动画能做到这种水平？它值得赢取满堂喝彩！
2019-07-19 12:53:57,5,力荐,28,小牛,自古红蓝出CP，藕饼组合得我心～为国产动画产业的未来祝福，为民族工业的强大点赞！
2019-07-27 00:14:04,5,力荐,7,王恶,我做过四个有关哪吒的项目，总是各种原因没成。无关哪吒的项目成活率90，有关哪吒的项目成活率0。可是其他项目我做完就忘了，哪吒的故事始终倒背如流。前年甚至做了一个类似《勇者义彦》的《太乙真人》，是一个神仙体系山海经无厘头的单元剧。影视行业最缺的是信任感、安全感，我没有名气，所以没人为我的idea投钱。这就是我看电影时想到的全部，我没有名气，是我亟待解决的问题。
2019-07-21 22:15:07,5,力荐,13,狮子,没有之一，今年暑期档最强作品，这还是我第一次看到有个国产动画片评分蹭蹭涨的。剧情的张力足够，节奏把控的很好很抓人；剧本写得相当棒，台词浅显易懂搞笑不断又有一些拔高；人物之间的羁绊强，年轻人们喜欢这CP已经分分钟组了起来，年长的人也乐于听到“命运是自己的而不是别人”这样的话题。不牵强不刻意，而且也不曲高和寡。不是那种神作，而是真正的好电影！希望能大卖！明年我要看你们家的《姜子牙》
2019-07-27 18:36:24,5,力荐,8,沈入忘🌟,各方面来说都很成熟啊，好看！看到友邻吐槽父子躬亲觉得违和，但我觉得这个动画应该说是哪吒的架空动画吧，和本来的传说没啥关系了。而且内核我觉得是天地不仁以万物为刍狗吧。不要怂是真的，一个个都身不由己也是真的，至于我命由我不由天，就只能说是精神上的胜利了吧。
2019-07-11 22:58:47,5,力荐,19,雨夜飞行,看完电影后，我望着地铁上不断踢我腿的熊孩子露出了慈父般的微笑。多少年了，第一次在国产新动画里看到这么好看的一个故事，感觉自己欣慰的像个老父亲
2019-07-17 22:10:49,4,推荐,5,思路乐,【B】超越《大圣归来》，成为近五年来我心中的国漫最佳。画面上的惊喜度真的超乎我想象，很多关于神灵道具的画面呈现与其背后所体现出的创作人员的想象力也令我意外（山河社稷图，风火轮，弹球游戏）。动作场面更是一流水准，酣畅淋漓，十分过瘾。而更难得的，是叙事上的扎实与创新。在叙事节奏上，《哪吒》要比《大圣》和《白蛇》好太多太多了，这也是观感上强于后两者的主要原因。而戏谑性质的颠覆性改编也要比他们更加流畅自然，对于命运的反抗和对自身的坚守这些主题本片可以说展现的非常完整。尽管仍然存在着很多过度安插笑点和配音的问题，仍然不失为一部佳作。
2019-08-05 20:49:29,4,推荐,1,寒狐传媒,青春期叛逆治疗典范。不少梗。
2019-07-23 17:36:23,5,力荐,13,你看起来很美味,没什么好说的。我觉得是我目前在电影院里看到过的最好的动画电影。没有之一。
2019-07-18 23:56:55,4,推荐,27,麦小白,看完开始期待封神宇宙了。无厘头、卖萌、鸡汤、热血，商业动画片的黄金配方一个不落。像一道菜，每味佐料的比例都拿捏得恰到好处，是一道色香味俱佳的国民菜，今年暑期档爆款预订没跑了。自来水，推一波！
2019-07-17 22:21:59,4,推荐,14,似水流年,其实够不到四星，但它在完成度和视觉想象力的基础上相比之前几部高口碑国产动画都更有主题深度，但又有所顾忌，既不愿意一黑到底，也想不出情节做升华性的诠释，编不下去了就把最内核的价值冲突留到彩蛋里甩给下一部，结尾则利用共情过渡到主流价值完成和解。喜剧思维也过于低级。
2019-07-20 17:36:46,5,力荐,7,所有团的团长,我先大喊三声牛逼！牛逼！牛逼！然后我的评价就8个字：史上最佳，买票去看。
2019-07-28 03:49:51,4,推荐,3,老阿飞—故园,成熟的商业动画！！故事上用绝代双骄解构了哪吒闹海，所有角色的塑造和相互关系都很用心的进行了设计，所有角色无论大小都给定了很有记忆点的特征（不管是否脸谱化），所有角色的动机和对剧情的推动都很合理；内核虽然是“寻找自我”的无国界少年成长命题，但是角色刻画却是相当中国的，比如慈母严父。如果说白蛇是青年向爱情片，哪吒基本就是热血少年番了，这两部动画基本上树立起了国产影院动画的标杆（就跟流浪地球树立国产科幻片的标杆一样）。但是虽然很多情节和场景在观看时候都很有冲击感，但是看完再回想却没有特别深刻的印象。
2019-08-06 21:50:22,5,力荐,17,音阙诗听,太惊艳了！完全颠覆！有笑有泪！烟熏妆哪吒真的好绝，我太喜欢哪吒的人设了，可爱又叛逆，“如果命运不公，就和他斗到底！”太乙居然讲的四川话，太逗了！敖丙就一个字，帅！自古红蓝出cp嗷。最后半小时视觉效果满分，真的燃燃燃！期待封神宇宙！
2019-07-20 20:46:54,5,力荐,11,Philia,对于喜爱79版《哪吒闹海》的观众来说，魔童的形象必定是极为另类的。但与其说它是一种颠覆，不如说它是一道补充，尤其是哪吒与李靖、敖丙的扩写，都在传递中华文化的价值取向：奉献与担当，以及更重要的“我命由我不由天”。它不仅是一部神话动画，也是一部亲子电影，还是一部教育电影片。片中一些刻意的搞笑我不喜欢（娘娘腔等），但李靖人设我非常可以，所以打平。值得指出的还有，人民这一符号在魔童这里是非常有意思的：一方面，人民是他疯魔的外在诱因，另一方面却也成了自我的尺度。更加富有政治意味的则是龙族归顺天庭和申公豹意欲封神。
2019-07-14 21:30:21,4,推荐,20,二火山,哪吒之风云必胜，内核对应了雄霸那句“老夫要逆天改命”。这类国产动画终于能按电影的节奏讲好一个故事了，哪吒和敖丙的CP分明参考的就是鸣人和佐助啊，特别好，磕定了。尬着尬着就笑了，国产动画第一次直白地出现了熊gay。这部铺了这么多，想做封神宇宙的话也别三部曲了，根本讲不完，就学漫威那样拍上十部吧！
2019-07-18 22:32:44,4,推荐,9,老罗Lazzaro,点映。画风似《白蛇》，哪吒和龙宫反形象暗黑设计加分，角色立体有魂，动作流畅丰富，彩蛋还埋续作伏笔。主旨在于不要在意旁人眼光要一鸣惊人，但故事还是有些低于预期。
2019-07-21 17:47:28,5,力荐,13,Bearkiii,近十年国产动画电影最佳。但是对票房持谨慎悲观态度。和基友所有团的团长打了个赌，如果票房过10亿，我给他发1000块钱红包。请大家让我输，谢谢。
2019-07-20 17:34:48,4,推荐,6,santawhale,陈塘关小鱼儿与花无缺绝了哈哈哈
2019-07-29 00:19:04,4,推荐,7,野子,低俗和恶搞拉低了这部电影的水准，总的来说瑕不掩瑜，算得上是部难得的国产电影，但成不了经典。
2019-08-03 00:27:09,4,推荐,1,わさびちゃん,好不好看先不说，反正当今所谓崛起的国漫的人物创造永远脱离不了孙悟空，白蛇这些在影视动画中用烂的形象了！这不，哪吒小朋友也来了，下一个会是谁呢？希望能有更多像大鱼海棠一样作品出现
2019-07-27 22:57:29,4,推荐,2,亲爱的猥琐猪,制作几乎是无可挑剔的，炫酷、霸气，甚而有为炫技而安排的画中游、悬崖夺笔等桥段。但静下来想一想又会感到空虚，热血高校浪子回头的哪吒，说一口四川普通话模仿哆啦A梦（或是《阿松》里大裤衩）的太乙，BL古风文常见受的龙太子，各种迪士尼式的怪和配角。笑点和泪点也是，几乎刚开始布局，就知道最终导向何处。一句“我命由我不由天”虽然热血，但又很套路。另一个导向也不太喜欢，就是堆特效，更大更强更亮几乎到光污染，这么爆发的震撼不如《哪吒闹海》里回头自刎的“静”与“小”。最后，把一个非常有社会话题与道德哲学意义的故事简化为个人的奋斗，表面是革新，实则是浅显了。这种故事新编在短期内会由于玩梗与接地气而有趣，但没有真正持久的美的生命力。希望以后能看到更大的进步。
2019-07-23 19:37:09,5,力荐,8,弗朗索瓦张。,我对动画片一向要求很高，很多好评如潮的动画都让我冷漠jpg，但是这部哪吒不禁从技术，运镜，节奏上吊打我的想象力，更难得的是把哪吒这个传统故事讲出了《冰雪奇缘》水准的精神内核，并且在爆笑指数和煽情指数上都让人不得不想起《寄生虫》。一部让人可以自豪地拿出去介绍中国电影的动画片！
2019-07-27 16:13:58,4,推荐,2,飞天御剑流,真敢做啊，海边聊天，光是一个海滩的外包1W以下我不接的啊。
2019-07-14 17:37:27,4,推荐,9,胖官赵,技术、故事、主题都有了，且把《悟空传》电影版没有做到的“我命由我不由天”完全贯彻了个彻底。哪吒、红孩儿、二郎神、孙悟空，都是中国神话里值得深挖的人物，普世性从上古穿透到现代，无论神性、魔性、人性，只要胶着在一起，永远会有说不尽的故事，不存在颠覆不颠覆，最颠覆的反倒是配角龙族。诙谐比沉重占比更大，论感人程度没有预告片那么强烈。哪吒X敖丙，我多年没磕到如此绝美的CP了，简直令人尖叫的程度，编剧绝对资深耽美读者。彩条屋应该是用这部片来唤起大家对封神之《姜子牙》的期待，乌尔善表示压力山大。
2019-07-18 21:58:59,4,推荐,6,影杂志,2019年目前最佳国产电影，哭了两次，大笑了无数次。这部电影将会和《钢铁侠》开启漫威宇宙一样，开启封神宇宙，未来很多年，我们将追着这个系列看，真可怕啊！
2019-08-06 21:00:26,5,力荐,6,呱啦啦,迄今最成熟的国产商业剧场动画，比大圣归来和大护法完成度都高
2019-07-20 18:31:23,5,力荐,11,扶不起先生,颠覆传统的神话故事，留下大体框架作为依托。叙事上掺杂着周氏无厘头的风格，将耳熟能详的故事推陈出新。人物设定饱满有度，不局限于单纯的善恶。用高超的特效去吸引观众的眼球，用原创的故事去激发观众的想象。老少皆宜的改编足以开创新的天地，尘封的文化桂宝被另类的成功解锁，不掺杂任何鼓励与同情，这是近几年来最佳的国产动画电影
2019-07-19 20:37:04,4,推荐,3,街坊饿霸,挺好看，但也很鸡贼。
2019-07-17 21:50:29,5,力荐,12,维雪魂,【B】有瑕疵但整体还是惊喜更多
2019-07-27 00:45:43,5,力荐,19,有朵奇葩的云,实名diss首页热评第一的熊猫大叔，单从几张海报就说是烂片无疑，肤浅的见识，打出的字都有语病，什么基本完全？？？你又有什么资格代表成人说不能接受这样的设定，撞壁要有度，你随便几句话就可以在电影上映前否定制作人员的心血？？
2019-07-17 21:15:03,5,力荐,30,豆芽儿,想让全世界都来看我们的哪吒！！！
2019-07-21 18:34:34,5,力荐,6,glow,可以说是年度国产电影最佳了，开始没看的时候看到网友评分这么高还在想是不是虚高。现在看完不是的，真的很喜欢这个改编，除了那些村民，听风就是风听风雨就是雨，每个人的人物设定都立得住。龙族太惨了，敖丙太帅了，哪吒变身之后也是帅，没变身的时候是个腹黑娃娃。当年还在上大学的时候，就看过导演的《打个大西瓜》，一个不是科班出身就因为爱好做了短片，到今年当了导演做了长篇，说实话，真的很佩服他。应该还是有下一集的吧，期待吧！
2019-07-17 22:29:17,4,推荐,14,SleepWalker,出人意料的精彩，年度超级黑马即将诞生。把哪吒塑造成一个孙悟空般的反英雄角色，颠覆成功。文本层面上，仍未摆脱国漫故事薄弱的老毛病，为了赶进度编排了最典型的三幕结构，造成深度有限，“我命由我不由天”这种主题幼稚且口号化；几处台词极其违和，为了制造笑点反而使故事脱节。从技术上讲，它也绝不是国产动画的“总统山”，依然是场景精美而人物粗糙。但整体看它仍然是出色的，因为优势太明显，其一是惊艳的动作设计，初入山河社稷图可以入选年度最佳段落，这个场景的分镜是主创想象力一次水银泻地般的展示，片尾则以缩略（宏观）的形式再次惊艳了一把，游戏感十足，中段水夜叉的追逐打斗戏也下了功夫；其二是将近半小时的第三幕，始终保持快节奏的连续打斗牢牢把控住观众情绪，哪吒两次变身是截然不同的气氛渲染，一惊一喜，全部燃爆。
2019-07-11 21:27:35,4,推荐,17,kakakarl,开始看方言笑点，很多形象在卖萌，觉得堆砌得有点多。但是随着剧情深入，不断解构哪吒，在得知李靖决定以命换命的时候开始哭…“我命由我不由天”，关于偏见和刻板印象，无论是魔丸哪吒，豹妖申公豹，还是龙族都是偏见和刻板，最后共同抗击天雷就相当于抗拒天命，我能成为谁只有我自己能说了算！哪吒和敖丙cp同人文预定～彩蛋的设计也很萌，原来《姜子牙》是系列下一部，“封神宇宙”开启了！
2019-07-14 23:59:51,4,推荐,4,暗号大老爷,在陈塘关口见敖丙，气坏了哪吒小将军。某自幼魔丸入了身，偶遇着太乙老真人。某中了敖丙的离间计，俺变化了申公豹捅他后庭。弃暗投明来修心，食娘的哺喂当报爷的恩。孝当报过仁心尽，再与那真人把话云，一不用战鼓咚咚打，二不用副将随后跟，只要火尖一杆枪，红绫金圈风火轮。十分钟内得了胜，你把莲花塑了某的身；十分钟内不得胜，陈塘百姓化埃尘。来来来，带过爷的风火轮，（摇板）我要把拉莱耶一扫平！
2019-07-20 18:23:36,4,推荐,9,proustalain,"其实主题还蛮直白老套的，虽然禁不起事后咂摸，好在剧作落地后的呈现效果藏拙成功，观影过程中节奏一直被推着走几乎来不及察觉这些瑕疵，倒是不错的寓教于乐方式。（父子情令我眼角滑落一滴眼泪（（期待封神大IP"
2019-07-13 21:48:56,5,力荐,28,尿裤侠,吹爆。角色够帅，故事够燃，人物够酷，场景够美，情感够充沛，动作戏和情感戏都做的十分出彩，电影想表达的主题也足够深刻，连国产动画最遭人诟病的剧本差的问题也在这一部电影中得到非常大的改变，角色塑造很成功，形象、性格、台词都能站得住脚。故事改编富有新意，各种极富小心思的设计数不胜数（比如非常有动画感的一些配角、道具、场景），视效质量美轮美奂，东方美学被发挥的淋漓尽致，前期美术和编剧的功力可见一斑，甚至中期后期的制作水平即使和同类型影片比也数一数二。
2019-07-13 17:19:10,5,力荐,8,小爱,43星。有些人设非常TimBurton，剧本没完成（也许故事会在《姜子牙》里继续），搞笑部分有时太尬，以及哪吒宝宝小时候太丧太痞接受不能。然鹅，挣脱了乾坤圈的成魔哪吒实在是过于狂气冲天、霸气爆表，帅到我头脑空白……动画史上最颠覆的哪吒值得这五颗星。
2019-07-19 23:43:45,4,推荐,19,菲驴驴,申公豹也是在抗命啊，最大的boss难道不是元始天尊嘛。他和天庭埋下全剧的所有矛盾，然后几乎缺席了整个剧，剩下的都是群众内斗。
2019-07-27 18:51:18,4,推荐,11,刮刮油,虽然人物性格都改了，但是挺好看。大场面前的配乐段起始跟《战神》的配乐……玩过都能听出来。
2019-07-29 16:05:28,5,力荐,4,凨,甩迪斯尼好几条街！技术已经达到顶级水平！故事改编得有趣有人情味！可惜“哪吒”好丑！为中国国产动画的进步感到骄傲！致敬每一个为中国动画努力拼搏的人！
2019-07-21 20:52:52,5,力荐,6,玖羽,制作质量出色，但不必要的低俗梗过多，拖累了水准。总体来说，和大圣归来相比，优点更多，缺点更少，同样打五星，大圣归来有不少鼓励分，但本片就比较少。遗憾的是，如果格调更高一点，就可以不算鼓励分而当之无愧了
2019-08-02 20:51:41,4,推荐,7,阿巴厮,再一次警告中国电影人，不准这样做电影了！不然还得花电影票钱！不可以！要坚持做烂片，不要又逼我花钱走进电影院！
2019-07-19 22:56:12,5,力荐,14,穿山,真香爆款，入股不亏！可能是近五年的最佳国产动画？大圣和哪吒都是道家美强惨顶流、反叛型超级英雄，哪吒传奇性更甚在于挣脱伦常、打破秩序，但现在这文化大环境也不好按原版整，所以“魔改”出了一条跳脱命运悲喜剧的新路：天命难违偏要违、破除成见解心魔。谁能想到最承袭《悟空传》精神的影视作品是这部呢……当然少不了和《大圣归来》比，《大圣》还有瘸腿的项目，到了《哪吒》各方面的完成度都很高，跟迪皮放一起也不觉得露怯啊！之前放低期待的笑点超出预料，有不少方言网络用语现代科技的挪用，低俗梗不过分，整体接地气抓人心，观影气氛特好反派龙族安上了情有可原的政治前史，背负太多且有殉道倾向的敖丙小哥哥是年度银幕心动boy了。太乙真人请去做游乐设施设计师，《超人总动员》的冰酷侠都没你会玩，看裤裆还用了《死吻》梗点个赞。
2019-07-21 21:00:03,4,推荐,8,リ,个人觉得搞笑桥段比较尬……但是总体比想象中好一些。上海美影版固然经典，但其实也不用纠结这一版改编里人物关系的改变，要讲的东西不一样。彩条屋封神宇宙值得期待！
2019-07-19 11:54:27,5,力荐,32,鹰小子。,15年的《大圣归来》巨大成功，今年的《哪吒》高口碑迅速扩散，明年的《姜子牙》万众举目！事实证明中国神话大IP就是一个一直以来被忽略的有着巨大利益的超级大IP！资本们！赶紧动手抢啊！周边做起来啊！动漫产业链啊！赶紧上啊！我们是拥有五千年神话的国家啊！成熟一点啊！急死我了！
2019-07-21 19:00:28,5,力荐,7,24city,拍的太棒了！人设的重塑，内核的升华，精致的视效和故事上老少皆宜的通俗，不端着但也不low，恰到好处的拿捏，真正的国漫之光！
2019-07-20 21:11:10,5,力荐,7,李厂长🉑,超好看啊我的妈呀，等不及结束先五分预订！大周末的竟然包场了，就仨人，又不吵又不闹腾…我一般在电影院不会哭，上次还是魁拔给我看哭。这个真的是值得二刷，什么都好，哎呀，看得我要回家画画🎨！！
2019-07-22 19:08:43,5,力荐,5,梦里诗书,基于哪吒传说的颠覆式改编，《哪吒之魔童降世》充沛的剧情构思下，电影有着打动人心的羁绊，有着催人泪目的亲情，有着关乎自我认知的觉醒，更还有着哪吒“我命由我不由天”热血的反叛意识，这部足以让人为之瞠目的国产动画，令人见证的不再仅是国漫的崛起，而是国漫拥有了真正能与好莱坞动画佳作相媲美的灵魂。
2019-07-20 19:11:51,5,力荐,8,clytze,好真好特别好说比大圣归来好吧，我不认，我有悟空滤镜。但是真的很棒，笑点很密，哭点忍不住的那种，看完小姐姐都在问妆花了没。设计的超有点，不能剧透，但是每一个人物都出彩有特点。中间一度好生气超级心疼哪吒能力没有好坏之分，是看你如何使用它。父母之爱子，真的很动人。太极生两仪，很中国。彩蛋有三个，但是最后一个是姜子牙广告。讲真的，中国古代神话故事这个max级别的IP，生生代代也看不够。
2019-07-19 22:28:54,5,力荐,16,本味何知,对哪吒形象的又一次重构，原著版是纯熊孩子，上美版是造反青年，央视版是英雄少年，这版是爽文热血逆天中二。总的来说，和我的认知有出入，且缺少回味的空间，五星是给技术给制作诚意的。
